date,question,answers,groups
2023-06-12,"BUCKS, HAIL, JAZZ, SHIFT, LEVEL, MOM, SNOW, RACECAR, SLEET, TAB, KAYAK, RETURN, OPTION, NETS, RAIN, HEAT","[['HAIL', 'RAIN', 'SLEET', 'SNOW'], ['BUCKS', 'HEAT', 'JAZZ', 'NETS'], ['OPTION', 'RETURN', 'SHIFT', 'TAB'], ['KAYAK', 'LEVEL', 'MOM', 'RACECAR']]","['WET WEATHER', 'NBA TEAMS', 'KEYBOARD KEYS', 'PALINDROMES']"
2023-06-13,"TIME, ESSENCE, SNEAKER, MILE, PEOPLE, SEA, LEAGUE, PUMP, YARD, ARE, BOOT, US, WHY, QUEUE, LOAFER, FOOT","[['BOOT', 'LOAFER', 'PUMP', 'SNEAKER'], ['FOOT', 'LEAGUE', 'MILE', 'YARD'], ['ESSENCE', 'PEOPLE', 'TIME', 'US'], ['ARE', 'QUEUE', 'SEA', 'WHY']]","['FOOTWEAR', 'UNITS OF LENGTH', 'MAGAZINES', 'LETTER HOMOPHONES']"
2023-06-14,"GOBBLE, KING, POM, NOSE, CHOW, TENOR, STOOGE, WOLF, PEKE, EYE, MOUTH, LAB, AMIGO, SCARF, CHEEK, PIT","[['CHEEK', 'EYE', 'MOUTH', 'NOSE'], ['CHOW', 'GOBBLE', 'SCARF', 'WOLF'], ['LAB', 'PEKE', 'PIT', 'POM'], ['AMIGO', 'KING', 'STOOGE', 'TENOR']]","['FACIAL FEATURES', 'SYNONYMS FOR EAT', 'DOG BREEDS, INFORMALLY', 'MEMBERS OF A TRIO']"
2023-06-15,"VACUUM, SWEEP, IRON, SUPER, MOP, PUMA, DUST, REEBOK, CATS, CABARET, ADIDAS, CHICAGO, SPIDER, BAT, CAROUSEL, NIKE","[['ADIDAS', 'NIKE', 'PUMA', 'REEBOK'], ['CABARET', 'CAROUSEL', 'CATS', 'CHICAGO'], ['DUST', 'MOP', 'SWEEP', 'VACUUM'], ['BAT', 'IRON', 'SPIDER', 'SUPER']]","['SNEAKER BRANDS', 'MUSICALS BEGINNING WITH “C”', 'CLEANING VERBS', '___ MAN SUPERHEROES']"
2023-06-16,"PLUM, GREEN, BLUE, TARTAR, MUSTARD, SCARLET, HULU, GLUM, MAYO, KETCHUP, NETFLIX, PEACOCK, PRIME, RELISH, DOWN, LOW","[['HULU', 'NETFLIX', 'PEACOCK', 'PRIME'], ['KETCHUP', 'MAYO', 'RELISH', 'TARTAR'], ['BLUE', 'DOWN', 'GLUM', 'LOW'], ['GREEN', 'MUSTARD', 'PLUM', 'SCARLET']]","['STREAMING SERVICES', 'CONDIMENTS', 'SYNONYMS FOR SAD', 'CLUE CHARACTERS']"
2023-06-17,"ICE CUBE, CHANCE, Q-TIP, MIDNIGHT, SISTER, POWDER, GO, SIN, COMMON, SEA, WONDER, FUTURE, BABY, JAIL, ROYAL, BOARDWALK","[['BOARDWALK', 'CHANCE', 'GO', 'JAIL'], ['BABY', 'MIDNIGHT', 'POWDER', 'ROYAL'], ['COMMON', 'FUTURE', 'ICE CUBE', 'Q-TIP'], ['SEA', 'SIN', 'SISTER', 'WONDER']]","['MONOPOLY SQUARES', 'SHADES OF BLUE', 'RAPPERS', 'MEMBERS OF A SEPTET']"
2023-06-18,"JOHN, CRAY, KID, CALF, THIGH, KNEE, SHIN, THRONE, JELLY, HEAD, SILVER, ANKLE, JOEY, STAR, CUB, CAN","[['ANKLE', 'KNEE', 'SHIN', 'THIGH'], ['CALF', 'CUB', 'JOEY', 'KID'], ['CAN', 'HEAD', 'JOHN', 'THRONE'], ['CRAY', 'JELLY', 'SILVER', 'STAR']]","['LEG PARTS', 'BABY ANIMALS', 'SLANG FOR TOILET', '___ FISH THAT AREN’T FISH']"
2023-06-19,"STOP SIGN, FULL, CHESS, QUEEN, LOCKSMITH, CHERRY, TWIN, CHECKERS, KING, FIRE TRUCK, PIANO, GO, FLORIDA, RUBY, CRYPTOGRAPHY, BACKGAMMON","[['BACKGAMMON', 'CHECKERS', 'CHESS', 'GO'], ['FULL', 'KING', 'QUEEN', 'TWIN'], ['CHERRY', 'FIRE TRUCK', 'RUBY', 'STOP SIGN'], ['CRYPTOGRAPHY', 'FLORIDA', 'LOCKSMITH', 'PIANO']]","['BOARD GAMES', 'MATTRESS SIZES', 'THINGS THAT ARE RED', 'THINGS WITH KEYS']"
2023-06-20,"ANT, TERMITE, CAMI, CARROT, MANTIS, BEET, HALTER, ONION, TEE, BEETLE, TANK, POLO, FENCING, CRICKET, SQUASH, CORN","[['CRICKET', 'FENCING', 'POLO', 'SQUASH'], ['CAMI', 'HALTER', 'TANK', 'TEE'], ['BEET', 'CARROT', 'CORN', 'ONION'], ['ANT', 'BEETLE', 'MANTIS', 'TERMITE']]","['SPORTS', 'TOPS', 'VEGETABLES', 'INSECTS']"
2023-06-21,"SWALLOW, FISH, TOGO, KIWI, CRANE, GEORGIA, ORANGE, LEMON, JORDAN, TURKEY, DATE, JAY, CHAD, GOAT, TWINS, SCALES","[['DATE', 'KIWI', 'LEMON', 'ORANGE'], ['CHAD', 'GEORGIA', 'JORDAN', 'TOGO'], ['CRANE', 'JAY', 'SWALLOW', 'TURKEY'], ['FISH', 'GOAT', 'SCALES', 'TWINS']]","['FRUIT', 'COUNTRIES', 'BIRDS', 'ZODIAC SYMBOLS']"
2023-06-22,"PEGASUS, SUGAR, POSH, CARDAMOM, AIRPLANE, CLOVE, BABY, SCARY, CORIANDER, CUMIN, GINGER, ANGEL, BIRD, HONEY, SWEETIE, BOO","[['CARDAMOM', 'CLOVE', 'CORIANDER', 'CUMIN'], ['BOO', 'HONEY', 'SUGAR', 'SWEETIE'], ['AIRPLANE', 'ANGEL', 'BIRD', 'PEGASUS'], ['BABY', 'GINGER', 'POSH', 'SCARY']]","['SPICES BEGINNING WITH “C”', 'TERMS OF ENDEARMENT', 'THINGS WITH WINGS', 'SPICE GIRLS']"
2023-06-23,"PRIDE, GREED, ENVY, TORTOISE, COT, SNAIL, LUST, SEC, TAN, POD, SCHOOL, FLOCK, PACK, SLOTH, SIN, LORIS","[['FLOCK', 'PACK', 'POD', 'SCHOOL'], ['ENVY', 'GREED', 'LUST', 'PRIDE'], ['LORIS', 'SLOTH', 'SNAIL', 'TORTOISE'], ['COT', 'SEC', 'SIN', 'TAN']]","['ANIMAL GROUP NAMES', 'DEADLY SINS', 'SLOW ANIMALS', 'TRIG FUNCTIONS']"
2023-06-24,"SPIRIT, DELTA, KNEW, GNAT, CHI, NEW, GNOME, VIRGIN, GNOCCHI, GNU, NU, UNITED, GNAW, IOTA, FRONTIER, BETA","[['FRONTIER', 'SPIRIT', 'UNITED', 'VIRGIN'], ['BETA', 'CHI', 'DELTA', 'IOTA'], ['GNAT', 'GNAW', 'GNOCCHI', 'GNOME'], ['GNU', 'KNEW', 'NEW', 'NU']]","['AIRLINES', 'GREEK LETTERS', 'SILENT “G”', 'HOMOPHONES']"
2023-06-25,"PILOT, TRUNDLE, CRASH, MARX, JONAS, MARIO, WRIGHT, WARNER, CIVIC, LINK, CANOPY, PASSPORT, MURPHY, BUNK, SONIC, ACCORD","[['BUNK', 'CANOPY', 'MURPHY', 'TRUNDLE'], ['JONAS', 'MARX', 'WARNER', 'WRIGHT'], ['ACCORD', 'CIVIC', 'PASSPORT', 'PILOT'], ['CRASH', 'LINK', 'MARIO', 'SONIC']]","['BEDS', 'FAMOUS BROTHERS', 'HONDAS', 'VIDEO GAME CHARACTERS']"
2023-06-26,"REEL, TURQUOISE, CLUCK, ROD, HOOK, PINK, TWEET, SILVER, VIOLET, SPARROW, BROWN, CAW, TACKLE, LURE, JONES, CHIRP","[['CAW', 'CHIRP', 'CLUCK', 'TWEET'], ['BROWN', 'PINK', 'TURQUOISE', 'VIOLET'], ['LURE', 'REEL', 'ROD', 'TACKLE'], ['HOOK', 'JONES', 'SILVER', 'SPARROW']]","['BIRD SOUNDS', 'COLORS', 'FISHING GEAR', 'FICTIONAL PIRATES']"
2023-06-27,"ALMOND, OLIVE, PECAN, EMERALD, LATTE, CLEAN, AMERICANO, CASHEW, CAPPUCCINO, PEANUT, KELLY, ESPRESSO, FOX, WALNUT, BEAN, FOREST","[['AMERICANO', 'CAPPUCCINO', 'ESPRESSO', 'LATTE'], ['ALMOND', 'CASHEW', 'PECAN', 'WALNUT'], ['EMERALD', 'FOREST', 'KELLY', 'OLIVE'], ['BEAN', 'CLEAN', 'FOX', 'PEANUT']]","['COFFEE DRINKS', 'TREE NUTS', 'SHADES OF GREEN', 'MR. ___']"
2023-06-28,"STARBOARD, SCARF, PORT, STERN, BERMUDA, GAIN, RIGHT, BOLO, ASCOT, ALL, ACUTE, BOW, TIE, LOVE, ERA, TIDE","[['ASCOT', 'BOLO', 'SCARF', 'TIE'], ['BOW', 'PORT', 'STARBOARD', 'STERN'], ['ALL', 'ERA', 'GAIN', 'TIDE'], ['ACUTE', 'BERMUDA', 'LOVE', 'RIGHT']]","['NECKWEAR', 'SHIP DIRECTIONS', 'DETERGENTS', '___ TRIANGLE']"
2023-06-29,"QUINN, HOUSE, COMMANDER, BEAR, BILL, LAT, TRI, TROPHY, CUP, PEC, GREY, QUAD, HOWSER, MEDAL, BROWN, RIBBON","[['LAT', 'PEC', 'QUAD', 'TRI'], ['CUP', 'MEDAL', 'RIBBON', 'TROPHY'], ['GREY', 'HOUSE', 'HOWSER', 'QUINN'], ['BEAR', 'BILL', 'BROWN', 'COMMANDER']]","['MUSCLES, INFORMALLY', 'AWARDS', 'TITLE TV DOCTORS', 'NFL PLAYERS']"
2023-06-30,"PORK, VENISON, EGGSHELL, QUARREL, BEEF, GARLIC, CREAM, CRUCIFIX, POULTRY, VANILLA, STAKE, IVORY, MIRROR, ROW, SPAT, TIFF","[['CREAM', 'EGGSHELL', 'IVORY', 'VANILLA'], ['CRUCIFIX', 'GARLIC', 'MIRROR', 'STAKE'], ['BEEF', 'PORK', 'POULTRY', 'VENISON'], ['ROW', 'QUARREL', 'SPAT', 'TIFF']]","['OFF-WHITE SHADES', 'ANTI-VAMPIRE', 'KINDS OF MEAT', 'SYNONYMS FOR ARGUMENT']"
2023-07-01,"RYE, BONG, BARLEY, OAT, BROWN, STONE, KING, HOWARD, DUKE, RICE, LEE, SPELT, FORD, EARL, PRINCE, BARON","[['BARLEY', 'OAT', 'RYE', 'SPELT'], ['BARON', 'EARL', 'KING', 'PRINCE'], ['BROWN', 'DUKE', 'HOWARD', 'RICE'], ['BONG', 'FORD', 'LEE', 'STONE']]","['GRAINS', 'ROYAL TITLES', 'UNIVERSITIES', 'BEST DIRECTOR OSCAR WINNERS']"
2023-07-02,"JON, BABY, MEG, WAYNE, AMY, POP, BETH, EDGE, JO, SAFARI, KIM, JAZZ, CHROME, OPERA, RAP, PUNK","[['JAZZ', 'POP', 'PUNK', 'RAP'], ['CHROME', 'EDGE', 'OPERA', 'SAFARI'], ['AMY', 'BETH', 'JO', 'MEG'], ['BABY', 'JON', 'KIM', 'WAYNE']]","['MUSIC GENRES', 'WEB BROWSERS', '“LITTLE WOMEN” SISTERS', 'LIL ___ RAPPERS']"
2023-07-03,"BITE, HUSKY, YIELD, STOP, TRUNK, WAVE, POODLE, BEAK, ASLEEP, SNOUT, BOXER, SLOW, BARRIER, MUZZLE, DALMATIAN, DETOUR","[['BOXER', 'DALMATIAN', 'HUSKY', 'POODLE'], ['BEAK', 'MUZZLE', 'SNOUT', 'TRUNK'], ['DETOUR', 'SLOW', 'STOP', 'YIELD'], ['ASLEEP', 'BARRIER', 'BITE', 'WAVE']]","['DOG BREEDS', 'ANIMAL NOSES', 'TRAFFIC SIGNS', 'SOUND ___']"
2023-07-04,"GOLF COURSE, BEACH BOY, MASHED POTATO, MACARENA, WIRED, DOUGIE, SAUSAGE, TWIST, VOGUE, WEBSITE, BEATLE, FORTUNE, ROLLING STONE, BYRD, MONKEE, CHAIN","[['BEACH BOY', 'BEATLE', 'BYRD', 'MONKEE'], ['DOUGIE', 'MACARENA', 'MASHED POTATO', 'TWIST'], ['FORTUNE', 'ROLLING STONE', 'VOGUE', 'WIRED'], ['CHAIN', 'GOLF COURSE', 'SAUSAGE', 'WEBSITE']]","['60’s BAND MEMBERS', 'DANCE FADS', 'MAGAZINES', 'THINGS WITH LINKS']"
2023-07-05,"CRUNCH, BOUNTY, MILKY WAY, GENESIS, BLINK, MAROON, COCHLEA, SUM, STIRRUP, U, WII, HAMMER, SWITCH, ANVIL, DREAMCAST, HEATH","[['BOUNTY', 'CRUNCH', 'HEATH', 'MILKY WAY'], ['DREAMCAST', 'GENESIS', 'SWITCH', 'WII'], ['ANVIL', 'COCHLEA', 'HAMMER', 'STIRRUP'], ['BLINK', 'MAROON', 'SUM', 'U']]","['CANDY BARS', 'VIDEO GAME CONSOLES', 'EAR PARTS', 'BAND NAMES MINUS NUMBERS']"
2023-07-06,"DARN, FUDGE, CHEESECAKE, PENCIL, ELEPHANT, WALRUS, FLAN, NARWHAL, HANDLEBAR, SHOOT, HIPPO, HORSESHOE, HECK, WARTHOG, TIRAMISU, MOUSSE","[['CHEESECAKE', 'FLAN', 'MOUSSE', 'TIRAMISU'], ['DARN', 'FUDGE', 'HECK', 'SHOOT'], ['ELEPHANT', 'HIPPO', 'NARWHAL', 'WARTHOG'], ['HANDLEBAR', 'HORSESHOE', 'PENCIL', 'WALRUS']]","['DESSERTS', 'MILD OATHS', 'ANIMALS WITH TUSKS', 'MUSTACHES']"
2023-07-07,"LIVID, DILL, MIMIC, MIX, PETTY, HOLLAND, GREECE, COPY, CRUISE, PORTUGAL, MILD, POLAND, ECHO, DENMARK, WAITS, PARROT","[['DENMARK', 'GREECE', 'POLAND', 'PORTUGAL'], ['COPY', 'ECHO', 'MIMIC', 'PARROT'], ['CRUISE', 'HOLLAND', 'PETTY', 'WAITS'], ['DILL', 'LIVID', 'MILD', 'MIX']]","['EUROPEAN COUNTRIES', 'SYNONYMS FOR IMITATE', 'TOMS', 'WORDS SPELLED WITH ROMAN NUMERALS']"
2023-07-08,"RABBIT, ASS, PAGE, FEDORA, POT, SPINE, JACKET, FEZ, BERET, KIDNEY, LUNG, LIVER, COVER, BOWLER, KNIFE, HEART","[['BERET', 'BOWLER', 'FEDORA', 'FEZ'], ['HEART', 'KIDNEY', 'LIVER', 'LUNG'], ['COVER', 'JACKET', 'PAGE', 'SPINE'], ['ASS', 'KNIFE', 'POT', 'RABBIT']]","['HATS', 'ORGANS', 'PARTS OF A BOOK', 'JACK ___']"
2023-07-09,"PINEAPPLE, DOC, KIWI, PDF, HAPPY, OSTRICH, ZIP, PENGUIN, TIFF, GIF, EMU, BANANA, MANGO, COCONUT, GRUMPY, BASHFUL","[['BASHFUL', 'DOC', 'GRUMPY', 'HAPPY'], ['GIF', 'PDF', 'TIFF', 'ZIP'], ['EMU', 'KIWI', 'OSTRICH', 'PENGUIN'], ['BANANA', 'COCONUT', 'MANGO', 'PINEAPPLE']]","['SEVEN DWARFS', 'FILE EXTENSIONS', 'FLIGHTLESS BIRDS', 'TROPICAL FRUITS']"
2023-07-10,"MULTIPLY, SKATE, DIVIDE, SUBTRACT, COOL, COPY, MOTH, TETRA, TANG, ALLEY, FLY, ADD, LAP, GNAT, SOLE, WASP","[['FLY', 'GNAT', 'MOTH', 'WASP'], ['ADD', 'DIVIDE', 'MULTIPLY', 'SUBTRACT'], ['TANG', 'TETRA', 'SKATE', 'SOLE'], ['ALLEY', 'COOL', 'COPY', 'LAP']]","['WINGED INSECTS', 'ARITHMETIC OPERATIONS', 'FISH', '___ CAT']"
2023-07-11,"KNEE, MOTHER, THEM, AIRPLANE, BRONCO, PACKER, OKLAHOMA, SHOULDER, SHELL, WRIST, SPIRAL, HIP, COWBOY, BOWTIE, ELBOW, RAVEN","[['BRONCO', 'COWBOY', 'PACKER', 'RAVEN'], ['BOWTIE', 'ELBOW', 'SHELL', 'SPIRAL'], ['HIP', 'KNEE', 'SHOULDER', 'WRIST'], ['AIRPLANE', 'MOTHER', 'OKLAHOMA', 'THEM']]","['NFL PLAYERS', 'PASTA SHAPES', 'JOINTS', 'MOVIES WITH “!”']"
2023-07-12,"MOBILE, LIMA, PHONE, TOMATO, MAC, EGGPLANT, POLISH, PAD, POD, JOB, PEPPER, SPHERE, CUBE, CONE, PYRAMID, CUCUMBER","[['CUCUMBER', 'EGGPLANT', 'PEPPER', 'TOMATO'], ['CONE', 'CUBE', 'PYRAMID', 'SPHERE'], ['MAC', 'PAD', 'PHONE', 'POD'], ['JOB', 'LIMA', 'MOBILE', 'POLISH']]","['VEGETABLES THAT ARE ALSO FRUITS', '3-D SHAPES', 'WORDS WITH “i”', 'WORDS WITH TWO PRONUNCIATIONS']"
2023-07-13,"SOLE, HEEL, CEMENT, LACE, TONGUE, BOND, BAND, SOUL, RYAN, SORRY, CLUE, TROUBLE, RISK, SMART, DUCKIE, HUNT","[['HEEL', 'LACE', 'SOLE', 'TONGUE'], ['CLUE', 'RISK', 'SORRY', 'TROUBLE'], ['BOND', 'HUNT', 'RYAN', 'SMART'], ['BAND', 'CEMENT', 'DUCKIE', 'SOUL']]","['SHOE PARTS', 'BOARD GAMES', 'FICTIONAL SPIES', 'RUBBER ___']"
2023-07-14,"TUG, CLUB, FLANK, LOIN, FERRY, JUNK, JOSH, CUBAN, ROUND, ROB, SUB, SUE, SHANK, YACHT, CHUCK, MELT","[['FERRY', 'JUNK', 'TUG', 'YACHT'], ['CLUB', 'CUBAN', 'MELT', 'SUB'], ['FLANK', 'LOIN', 'ROUND', 'SHANK'], ['CHUCK', 'JOSH', 'ROB', 'SUE']]","['BOATS', 'SANDWICHES', 'CUTS OF BEEF', 'NICKNAMES THAT ARE VERBS']"
2023-07-15,"SCISSORS, SCENT, PAPER, BOUQUET, BUCK, COUNTRY, SOUL, JACK, FUNK, SHOOT, BLUES, ROCK, BULL, AROMA, BOAR, FRAGRANCE","[['AROMA', 'BOUQUET', 'FRAGRANCE', 'SCENT'], ['BLUES', 'COUNTRY', 'FUNK', 'SOUL'], ['PAPER', 'ROCK', 'SCISSORS', 'SHOOT'], ['BOAR', 'BUCK', 'BULL', 'JACK']]","['PLEASANT SMELLS', 'MUSIC GENRES', 'ROCK PAPER SCISSORS', 'MALE ANIMALS']"
2023-07-16,"SO, LEAD, PENNY, QUARTER, NECK, CLOVER, HALF, MOON, TIN, HORSESHOE, DIME, IRON, NICKEL, AGAIN, RAINBOW, ZINC","[['DIME', 'NICKEL', 'PENNY', 'QUARTER'], ['IRON', 'LEAD', 'TIN', 'ZINC'], ['CLOVER', 'HORSESHOE', 'MOON', 'RAINBOW'], ['AGAIN', 'HALF', 'NECK', 'SO']]","['U.S. COINS', 'METAL ELEMENTS', 'LUCKY CHARMS MARSHMALLOWS', '___ AND ___']"
2023-07-17,"EYE, CHEDDAR, CRUNCH, TRUTH, MOUNDS, WOMBAT, MARS, MOLE RAT, WALLABY, KOALA, GUN, CHUNKY, PAPER, KANGAROO, STACKS, DOUGH","[['KANGAROO', 'KOALA', 'WALLABY', 'WOMBAT'], ['CHUNKY', 'CRUNCH', 'MARS', 'MOUNDS'], ['CHEDDAR', 'DOUGH', 'PAPER', 'STACKS'], ['EYE', 'GUN', 'MOLE RAT', 'TRUTH']]","['MARSUPIALS', 'CHOCOLATE BARS', 'SLANG FOR MONEY', 'NAKED ___']"
2023-07-18,"SEAL, HAWK, MOVE, TONG, BRAKE, CUB, DOLPHIN, CHIN, CHAIN, PEDDLE, OTTER, SADDLE, MALT, SPOKE, VEND, MANATEE","[['DOLPHIN', 'MANATEE', 'OTTER', 'SEAL'], ['BRAKE', 'CHAIN', 'SADDLE', 'SPOKE'], ['HAWK', 'MOVE', 'PEDDLE', 'VEND'], ['CHIN', 'CUB', 'MALT', 'TONG']]","['MARINE MAMMALS', 'BIKE PARTS', 'SYNONYMS FOR SELL', 'COUNTRIES WHEN “A” IS ADDED']"
2023-07-19,"CEDAR, ELM, MOUNTAIN, PLATEAU, MAPLE, ASH, FEAR, ONION, PLAIN, HILL, SESAME, PINE, POPPY, VALLEY, EVERYTHING, JUMP","[['ASH', 'CEDAR', 'MAPLE', 'PINE'], ['HILL', 'MOUNTAIN', 'PLATEAU', 'VALLEY'], ['EVERYTHING', 'ONION', 'PLAIN', 'POPPY'], ['ELM', 'FEAR', 'JUMP', 'SESAME']]","['TREES', 'LAND FORMATIONS', 'BAGEL FLAVORS', 'STREETS ON SCREEN']"
2023-07-20,"EVIL, HERTZ, SECOND, PIXIE, NO, HOURGLASS, WATCH, NEWTON, MOLE, CROP, SUNDIAL, PEPPER, CLOCK, J, BOB, SHAG","[['CLOCK', 'HOURGLASS', 'SUNDIAL', 'WATCH'], ['BOB', 'CROP', 'PIXIE', 'SHAG'], ['HERTZ', 'MOLE', 'NEWTON', 'SECOND'], ['EVIL', 'J', 'NO', 'PEPPER']]","['TIMEKEEPING DEVICES', 'HAIRSTYLES', 'UNITS OF MEASURE', 'DR. ___']"
2023-07-21,"MONK, LID, CLARINET, TOP, AVIATOR, HARP, HARBOR, CAT EYE, COVER, CAP, HOODED, OBOE, WAYFARER, BASSOON, FLUTE, WRAPAROUND","[['BASSOON', 'CLARINET', 'FLUTE', 'OBOE'], ['CAP', 'COVER', 'LID', 'TOP'], ['AVIATOR', 'CAT EYE', 'WAYFARER', 'WRAPAROUND'], ['HARBOR', 'HARP', 'HOODED', 'MONK']]","['WOODWINDS', 'COVERINGS', 'SUNGLASSES', 'SEALS']"
2023-07-22,"VOSS, TONY, BREW, SAM, POP, FIJI, JAVA, MUD, JAPAN, DASANI, CUBA, MALTA, JOE, PALAU, LUCKY, EVIAN","[['DASANI', 'EVIAN', 'FIJI', 'VOSS'], ['BREW', 'JAVA', 'JOE', 'MUD'], ['CUBA', 'JAPAN', 'MALTA', 'PALAU'], ['LUCKY', 'POP', 'SAM', 'TONY']]","['BOTTLED WATER BRANDS', 'SLANG FOR COFFEE', 'ISLAND COUNTRIES', 'CEREAL MASCOTS']"
2023-07-23,"BOLT, FAT, HYPHEN, DOJA, FINS, COMMA, JUNGLE, SNORKEL, DASH, TANK, MASK, PERIOD, RACE, HOUSE, COLON, SPRINT","[['FINS', 'MASK', 'SNORKEL', 'TANK'], ['COLON', 'COMMA', 'HYPHEN', 'PERIOD'], ['BOLT', 'DASH', 'RACE', 'SPRINT'], ['DOJA', 'FAT', 'HOUSE', 'JUNGLE']]","['SCUBA GEAR', 'PUNCTUATION MARKS', 'RUN QUICKLY', '___ CAT']"
2023-07-24,"BEASTIE, PUFFIN, LIVID, INCENSED, IRATE, SUNFLOWER, LOST, BOOBY, SCHOOL BUS, PELICAN, GULL, FURIOUS, HARDY, CANARY, BANANA, BEACH","[['FURIOUS', 'INCENSED', 'IRATE', 'LIVID'], ['BANANA', 'CANARY', 'SCHOOL BUS', 'SUNFLOWER'], ['BOOBY', 'GULL', 'PELICAN', 'PUFFIN'], ['BEACH', 'BEASTIE', 'HARDY', 'LOST']]","['SYNONYMS FOR ANGRY', 'THINGS THAT ARE YELLOW', 'MARINE BIRDS', '___ BOYS']"
2023-07-25,"SOLID, PASTE, COPY, UNDO, TESLA, LIQUID, CRUSH, GAS, STALE, TRASH, SLATE, LEAST, PLASMA, CUT, ROUT, SHELLAC","[['GAS', 'LIQUID', 'PLASMA', 'SOLID'], ['COPY', 'CUT', 'PASTE', 'UNDO'], ['CRUSH', 'ROUT', 'SHELLAC', 'TRASH'], ['LEAST', 'SLATE', 'STALE', 'TESLA']]","['STATES OF MATTER', 'EDIT MENU COMMANDS', 'DEFEAT BADLY', 'ANAGRAMS']"
2023-07-26,"FLOYD, KING, SONIC, STRIPES, MAGIC, THUNDER, PLANE, SUBWAY, TRAIN, BOAT, SUN, OUTBACK, CHECKERS, DAY, CAR, SABBATH","[['BOAT', 'CAR', 'PLANE', 'TRAIN'], ['KING', 'MAGIC', 'SUN', 'THUNDER'], ['CHECKERS', 'OUTBACK', 'SONIC', 'SUBWAY'], ['DAY', 'FLOYD', 'SABBATH', 'STRIPES']]","['MODES OF TRANSPORTATION', 'NBA PLAYERS', 'FAST FOOD CHAINS', 'BAND NAMES MINUS COLORS']"
2023-07-27,"SQUALL, CYCLONE, TORNADO, CHICAGO, MANHATTAN, ELLE, W, COSMOPOLITAN, RIO, MUNICH, ALLURE, BLIZZARD, SCREWDRIVER, HURRICANE, GLAMOUR, PHILADELPHIA","[['CHICAGO', 'MUNICH', 'PHILADELPHIA', 'RIO'], ['ALLURE', 'ELLE', 'GLAMOUR', 'W'], ['BLIZZARD', 'CYCLONE', 'SQUALL', 'TORNADO'], ['COSMOPOLITAN', 'HURRICANE', 'MANHATTAN', 'SCREWDRIVER']]","['MOVIE TITLE CITIES', 'FASHION MAGAZINES', 'STORMS', 'COCKTAILS']"
2023-07-28,"CAN, WARRIOR, GRASSLAND, CHAMELEON, MONITOR, DESERT, TREE, CHA, NAE, GECKO, FOREST, TUNDRA, COBRA, GO, IGUANA, LOTUS","[['DESERT', 'FOREST', 'GRASSLAND', 'TUNDRA'], ['CHAMELEON', 'GECKO', 'IGUANA', 'MONITOR'], ['COBRA', 'LOTUS', 'TREE', 'WARRIOR'], ['CAN', 'CHA', 'GO', 'NAE']]","['BIOMES', 'LIZARDS', 'YOGA POSES', 'DANCES WHEN DOUBLED']"
2023-07-29,"SPECTER, BEAST, POKE, DENIM, STITCH, PHANTOM, TEASE, GENIE, SCAR, TWEED, NEEDLE, SPIRIT, RIB, CORDUROY, LINEN, GHOST","[['CORDUROY', 'DENIM', 'LINEN', 'TWEED'], ['GHOST', 'PHANTOM', 'SPECTER', 'SPIRIT'], ['NEEDLE', 'POKE', 'RIB', 'TEASE'], ['BEAST', 'GENIE', 'SCAR', 'STITCH']]","['FABRICS', 'APPARITIONS', 'SYNONYMS FOR BOTHER', 'DISNEY CHARACTERS']"
2023-07-30,"CUCKOO, AUNT, MOTHER, DAFFY, DAISY, KOOKY, ALARM, GRANDFATHER, NEPHEW, DEWEY, SCROOGE, COUSIN, QUIRKY, BIOLOGICAL, DONALD, WACKY","[['AUNT', 'COUSIN', 'MOTHER', 'NEPHEW'], ['DAFFY', 'KOOKY', 'QUIRKY', 'WACKY'], ['DAISY', 'DEWEY', 'DONALD', 'SCROOGE'], ['ALARM', 'BIOLOGICAL', 'CUCKOO', 'GRANDFATHER']]","['RELATIVES', 'SYNONYMS FOR OFFBEAT', 'DISNEY DUCKS', '___ CLOCK']"
2023-07-31,"KATSU, YARD, INCH, TEMPERA, FALAFEL, PEN, SAMOSA, OIL, NICK, FOOT, ACRYLIC, DIM, QUART, SCHNITZEL, MILE, WATERCOLOR","[['FOOT', 'INCH', 'MILE', 'YARD'], ['ACRYLIC', 'OIL', 'TEMPERA', 'WATERCOLOR'], ['FALAFEL', 'KATSU', 'SAMOSA', 'SCHNITZEL'], ['DIM', 'NICK', 'PEN', 'QUART']]","['UNITS OF LENGTH', 'TYPES OF PAINT', 'DEEP-FRIED FOOD', 'STARTS OF U.S. COINS']"
2023-08-01,"LOST BOYS, MATCH, SCOTT, NEAR DARK, BUMBLE, ANT, HERO, WEST, DRIVER, BLADE, TINDER, HINGE, SUB, HOAGIE, GRINDER, TWILIGHT","[['HERO', 'HOAGIE', 'GRINDER', 'SUB'], ['BUMBLE', 'HINGE', 'MATCH', 'TINDER'], ['BLADE', 'LOST BOYS', 'NEAR DARK', 'TWILIGHT'], ['ANT', 'DRIVER', 'SCOTT', 'WEST']]","['LONG SANDWICHES', 'DATING APPS', 'VAMPIRE MOVIES', 'ADAMS']"
2023-08-02,"GERBIL, TRIANGLE, GRIPE, CARP, HAMSTER, HORN, MONITOR, MOUSE, VOLE, ORGAN, RAT, MOAN, GROUSE, SPEAKER, KEYBOARD, HARP","[['KEYBOARD', 'MONITOR', 'MOUSE', 'SPEAKER'], ['GERBIL', 'HAMSTER', 'RAT', 'VOLE'], ['HARP', 'HORN', 'ORGAN', 'TRIANGLE'], ['CARP', 'GRIPE', 'GROUSE', 'MOAN']]","['COMPUTER EQUIPMENT', 'RODENTS', 'MUSICAL INSTRUMENTS', 'SYNONYMS FOR COMPLAIN']"
2023-08-03,"SWARM, HIGH, BIO, LIT, CHEM, ORDER, FAMILY, HERD, STATS, DOMAIN, BLAZED, GOV, COLONY, CLASS, PRIDE, BAKED","[['COLONY', 'HERD', 'PRIDE', 'SWARM'], ['BAKED', 'BLAZED', 'HIGH', 'LIT'], ['BIO', 'CHEM', 'GOV', 'STATS'], ['CLASS', 'DOMAIN', 'FAMILY', 'ORDER']]","['ANIMAL GROUP NAMES', 'STONED', 'AP CLASSES', 'TAXONOMY RANKS']"
2023-08-04,"GARFIELD, FELIX, HARRY, CALVIN, TEMPLE, SYLVESTER, ROCKY, ABBEY, SHRINE, SILK, TOM, HIGH, GROVER, CHESTER, RELIQUARY, ALTAR","[['ALTAR', 'RELIQUARY', 'SHRINE', 'TEMPLE'], ['FELIX', 'GARFIELD', 'SYLVESTER', 'TOM'], ['CALVIN', 'CHESTER', 'GROVER', 'HARRY'], ['ABBEY', 'HIGH', 'ROCKY', 'SILK']]","['PLACES FOR WORSHIP', 'CARTOON CATS', 'PRESIDENTIAL FIRST NAMES', '___ ROAD']"
2023-08-05,"MEMORY, DOLL, JULIET, PUCK, BLOCKS, DUNCAN, LEGGINGS, FISH, EGGNOG, SELFIE, GIGGLE, HOCKEY, BAGGAGE, YO-YO, VIOLA, TOP","[['BLOCKS', 'DOLL', 'TOP', 'YO-YO'], ['BAGGAGE', 'EGGNOG', 'GIGGLE', 'LEGGINGS'], ['DUNCAN', 'JULIET', 'PUCK', 'VIOLA'], ['FISH', 'HOCKEY', 'MEMORY', 'SELFIE']]","['CLASSIC TOYS', 'WORDS WITH THREE G’S', 'SHAKESPEARE CHARACTERS', '___ STICK']"
2023-08-06,"PAC, SPREAD, ASTEROIDS, SWING, CHAINZ, TANGO, PINCH, SWIPE, BREAKOUT, PONG, TAP, SALSA, CENT, FROGGER, SAVAGE, HUSTLE","[['ASTEROIDS', 'BREAKOUT', 'FROGGER', 'PONG'], ['HUSTLE', 'SALSA', 'SWING', 'TANGO'], ['PINCH', 'SPREAD', 'SWIPE', 'TAP'], ['CENT', 'CHAINZ', 'PAC', 'SAVAGE']]","['CLASSIC ARCADE GAMES', 'DANCES', 'TOUCHSCREEN GESTURES', 'RAPPERS MINUS NUMBERS']"
2023-08-07,"HORROR, PAISLEY, STRIPES, PLAID, DOT, LIE, FIB, WHOPPER, TALE, KISS, GOOBER, FICTION, WESTERN, ROMANCE, HOUNDSTOOTH, MUSICAL","[['HORROR', 'MUSICAL', 'ROMANCE', 'WESTERN'], ['HOUNDSTOOTH', 'PAISLEY', 'PLAID', 'STRIPES'], ['FIB', 'FICTION', 'LIE', 'TALE'], ['DOT', 'GOOBER', 'KISS', 'WHOPPER']]","['MOVIE GENRES', 'PATTERNS', 'SYNONYMS FOR FALSEHOOD', 'CANDY PIECES']"
2023-08-08,"STATE, EEL, CHAR, CRIBS, BLADE, BLACK WIDOW, PERCH, SPIDER, FLASH, SCORPION, TICK, SHARK, STORM, MITE, CATFISH, JACKASS","[['MITE', 'SCORPION', 'SPIDER', 'TICK'], ['CHAR', 'EEL', 'PERCH', 'SHARK'], ['BLACK WIDOW', 'BLADE', 'FLASH', 'STORM'], ['CATFISH', 'CRIBS', 'JACKASS', 'STATE']]","['ARACHNIDS', 'FISH', 'SUPERHEROES', 'MTV SHOWS']"
2023-08-09,"SEVERAL, FEW, MELLON, PLUMB, ASTEROID, POST, PLANET, GLOBE, PAIR, JOURNAL, SOME, MOON, LYME, SUN, HANDFUL, COMET","[['FEW', 'HANDFUL', 'SEVERAL', 'SOME'], ['ASTEROID', 'COMET', 'MOON', 'PLANET'], ['GLOBE', 'JOURNAL', 'POST', 'SUN'], ['LYME', 'MELLON', 'PAIR', 'PLUMB']]","['UNSPECIFIED QUANTITIES', 'CELESTIAL OBJECTS', 'NEWSPAPERS', 'FRUIT HOMOPHONES']"
2023-08-10,"FIELD, DIAMOND, RINK, SCREAM, SAW, ANKLET, BROOCH, CHARM, PLEASE, PENDANT, DELIGHT, BANGLE, RING, COURT, PURGE, TICKLE","[['PURGE', 'RING', 'SAW', 'SCREAM'], ['COURT', 'DIAMOND', 'FIELD', 'RINK'], ['CHARM', 'DELIGHT', 'PLEASE', 'TICKLE'], ['ANKLET', 'BANGLE', 'BROOCH', 'PENDANT']]","['HORROR FRANCHISES', 'SPORTS VENUES', 'MAKE HAPPY', 'JEWELRY']"
2023-08-11,"CRIKEY, SELLING, GIFT, MATE, WEST, FLAIR, FACULTY, FEYNMAN, HAWKING, GENIUS, OPPENHEIMER, MATCH, MOOT, BUSH, EINSTEIN, BARBIE","[['EINSTEIN', 'FEYNMAN', 'HAWKING', 'OPPENHEIMER'], ['FACULTY', 'FLAIR', 'GENIUS', 'GIFT'], ['BARBIE', 'BUSH', 'CRIKEY', 'MATE'], ['MATCH', 'MOOT', 'SELLING', 'WEST']]","['THEORETICAL PHYSICISTS', 'TALENT', 'AUSTRALIAN TERMS', '___ POINT']"
2023-08-12,"XI, PI, FE, LA, TI, MU, ME, FA, MA, PA, NA, CO, HE, NI, DO, NU","[['CO', 'MA', 'ME', 'PA'], ['DO', 'FA', 'LA', 'TI'], ['MU', 'NU', 'PI', 'XI'], ['FE', 'HE', 'NA', 'NI']]","['STATE ABBREVIATIONS', 'MUSICAL NOTES', 'GREEK LETTERS', 'PERIODIC TABLE SYMBOLS']"
2023-08-13,"PRESS, OBVIOUS, SNAP, KANGAROO, NADA, ZIP, PLANET, JACK, CRUNCH, LUNGE, CURL, NOTHING, BUTTON, SQUAT, PLANK, BUCKLE","[['BUCKLE', 'BUTTON', 'SNAP', 'ZIP'], ['JACK', 'NADA', 'NOTHING', 'SQUAT'], ['CURL', 'LUNGE', 'PLANK', 'PRESS'], ['CRUNCH', 'KANGAROO', 'OBVIOUS', 'PLANET']]","['FASTENING VERBS', 'SLANG FOR ZERO', 'GYM EXERCISES', '“CAPTAINS”']"
2023-08-14,"BONE, CHUM, SINKER, BAIT, CATCH, SHIRT, SPOT, LUCKY, FLY, OBSERVE, NOTICE, REX, STORM, ROVER, FIDO, SEE","[['FIDO', 'LUCKY', 'ROVER', 'SPOT'], ['CATCH', 'NOTICE', 'OBSERVE', 'SEE'], ['BAIT', 'CHUM', 'FLY', 'SINKER'], ['BONE', 'REX', 'SHIRT', 'STORM']]","['CLASSIC DOG NAMES', 'PERCEIVE', 'FISHING TERMS', 'T-___']"
2023-08-15,"STEAM, SATURN, FIRE, LIQUID, WEDDING, PLASMA, TREE, SOLID, AIR, CIRCUS, JUICE, SPIRIT, GAS, VIGOR, WATER, EARTH","[['GAS', 'LIQUID', 'PLASMA', 'SOLID'], ['JUICE', 'SPIRIT', 'STEAM', 'VIGOR'], ['AIR', 'EARTH', 'FIRE', 'WATER'], ['CIRCUS', 'SATURN', 'TREE', 'WEDDING']]","['STATES OF MATTER', 'ENERGY', 'CLASSICAL ELEMENTS', 'THINGS WITH RINGS']"
2023-08-16,"EGG, OMELET, MILLENNIUM, YEAR, MUNCH, ROSE, BACON, WHISTLER, CENTURY, CLOSE, CEREAL, PANCAKE, MONTH, DECADE, WAFFLE, JUROR","[['CENTURY', 'DECADE', 'MILLENNIUM', 'YEAR'], ['CEREAL', 'OMELET', 'PANCAKE', 'WAFFLE'], ['BACON', 'CLOSE', 'MUNCH', 'WHISTLER'], ['EGG', 'JUROR', 'MONTH', 'ROSE']]","['TIME PERIODS', 'BREAKFAST FOODS', 'PAINTERS', 'ONE IN A DOZEN']"
2023-08-17,"PIE, DANCE, TART, SMITH, COBBLER, CAKE, TWIST, ROOT, DOCTOR, MILLER, ONE, MASON, DISTORT, FISHER, MEAL, FUDGE","[['CAKE', 'COBBLER', 'PIE', 'TART'], ['FISHER', 'MASON', 'MILLER', 'SMITH'], ['DISTORT', 'DOCTOR', 'FUDGE', 'TWIST'], ['DANCE', 'MEAL', 'ONE', 'ROOT']]","['DESSERTS', 'OCCUPATIONAL SURNAMES', 'ALTER DECEPTIVELY', 'SQUARE ___']"
2023-08-18,"COFFEE, CUP, POUND, SPONGE, AWFUL, RAND, GALLON, PINT, QUITE, CARROT, VERY, SUPER, WON, QUART, REAL, STERLING","[['CUP', 'GALLON', 'PINT', 'QUART'], ['AWFUL', 'QUITE', 'SUPER', 'VERY'], ['RAND', 'REAL', 'STERLING', 'WON'], ['CARROT', 'COFFEE', 'POUND', 'SPONGE']]","['UNITS OF VOLUME', 'EXTREMELY', 'WORLD CURRENCIES', '___ CAKE']"
2023-08-19,"PAL, MATE, PUMP, SKILLET, BUD, CLOG, GRASS, CROCK, SLIDE, MARY JANE, WOK, WEED, POT, CHUM, HERB, WEDGE","[['BUD', 'CHUM', 'MATE', 'PAL'], ['CROCK', 'POT', 'SKILLET', 'WOK'], ['CLOG', 'PUMP', 'SLIDE', 'WEDGE'], ['GRASS', 'HERB', 'MARY JANE', 'WEED']]","['FRIEND', 'COOKWEAR', 'SHOES', 'SLANG FOR CANNABIS']"
2023-08-20,"SLIGHT, COOLER, CAMPER, TENT, BARB, DISS, MEAL, MEDIUM, LANTERN, SMALL, WEE, HOUR, MINUTE, JAB, DIG, SLEEPING BAG","[['COOLER', 'LANTERN', 'SLEEPING BAG', 'TENT'], ['BARB', 'DIG', 'DISS', 'JAB'], ['MINUTE', 'SLIGHT', 'SMALL', 'WEE'], ['CAMPER', 'HOUR', 'MEAL', 'MEDIUM']]","['CAMPING SUPPLIES', 'INSULT', 'TINY', 'HAPPY ___']"
2023-08-21,"CRUSH, COLORADO, RUSH, UTAH, GENESIS, HAWK, SPRITE, YES, MUG, SQUIRT, ARIZONA, KANSAS, STARK, MONTANA, NEVADA, SOPRANO","[['ARIZONA', 'COLORADO', 'NEVADA', 'UTAH'], ['CRUSH', 'MUG', 'SPRITE', 'SQUIRT'], ['GENESIS', 'KANSAS', 'RUSH', 'YES'], ['HAWK', 'MONTANA', 'SOPRANO', 'STARK']]","['U.S. MOUNTAIN STATES', 'SODA BRANDS', 'CLASSIC ROCK BANDS', 'TONY ___']"
2023-08-22,"CARD, CUPID, HEART, ROSE, VIXEN, SANTA, ACTOR, LIEUTENANT, CHOCOLATE, BOYS, DASHER, TASTE, STAND-UP, COMET, DANCER, SINGER","[['ACTOR', 'DANCER', 'SINGER', 'STAND-UP'], ['COMET', 'CUPID', 'DASHER', 'VIXEN'], ['CARD', 'CHOCOLATE', 'HEART', 'ROSE'], ['BOYS', 'LIEUTENANT', 'SANTA', 'TASTE']]","['PERFORMING ARTISTS', 'SANTA’S REINDEER', 'SEEN ON VALENTINE’S DAY', '“BAD ___” MOVIES']"
