date,question,answers,groups
2023-11-03,"WE, THOUGH, HOWEVER, KNOCK, SEE, YOU, ARE, HEAR, JELLY, YET, FAMILY, THERE, FLUSH, STILL, WHY, TUT","[['HOWEVER', 'STILL', 'THOUGH', 'YET'], ['HEAR', 'KNOCK', 'THERE', 'TUT'], ['ARE', 'SEE', 'WHY', 'YOU'], ['FAMILY', 'FLUSH', 'JELLY', 'WE']]","['NEVERTHELESS', 'REPEATED WORDS IN EXPRESSIONS', 'WORDS ABBREVIATED WITH LETTERS', 'ROYAL ___']"
2023-11-04,"STUDY, CIGARETTE, STRAW, BIKE, KNIFE, TUBE, WRENCH, SPORTS, HOSE, CANDLESTICK, TICKET, TRAIN, ROPE, PIPE, PRACTICE, DRILL","[['DRILL', 'PRACTICE', 'STUDY', 'TRAIN'], ['HOSE', 'PIPE', 'STRAW', 'TUBE'], ['CANDLESTICK', 'KNIFE', 'ROPE', 'WRENCH'], ['CIGARETTE', 'BIKE', 'TICKET', 'SPORTS']]","['WAYS TO PREPARE', 'HOLLOW CYLINDERS', 'WEAPONS IN THE GAME CLUE', '“E-” THINGS']"
2023-11-05,"BICYCLE, BILLBOARD, STEADY, PITCHFORK, PIN, SPIT, UNIFORM, LANCE, STABLE, ROLLING STONE, SPIN, TRILOGY, LEVEL, QUADRANT, SKEWER, EVEN","[['EVEN', 'LEVEL', 'STABLE', 'STEADY'], ['LANCE', 'PIN', 'SKEWER', 'SPIT'], ['BILLBOARD', 'PITCHFORK', 'ROLLING STONE', 'SPIN'], ['UNIFORM', 'BICYCLE', 'TRILOGY', 'QUADRANT']]","['UNCHANGING', 'LONG, SHARP OBJECTS', 'MUSIC PUBLICATIONS', 'WORDS WITH NUMERICAL PREFIXES']"
2023-11-06,"WISH, SUGAR, OPTION, LP, ICE, STOCK, BOUILLON, CD, VINYL, SOUP, DIE, PLATTER, FUNNY, WAX, HERRING, BOND","[['BOND', 'CD', 'OPTION', 'STOCK'], ['LP', 'PLATTER', 'VINYL', 'WAX'], ['BOUILLON', 'DIE', 'ICE', 'SUGAR'], ['FUNNY', 'HERRING', 'SOUP', 'WISH']]","['INVESTMENTS', 'TERMS FOR RECORDS', 'CUBE-SHAPED', 'WORDS THAT GO WITH “BONE”']"
2023-11-07,"CAMP, RAT, RING, DIVISION, SQUEAL, FACTION, WORD, SURFACE, SNITCH, PING, EDGE, SING, DING, BING, WING, CHIME","[['CHIME', 'DING', 'PING', 'RING'], ['RAT', 'SING', 'SNITCH', 'SQUEAL'], ['CAMP', 'DIVISION', 'FACTION', 'WING'], ['BING', 'EDGE', 'SURFACE', 'WORD']]","['DIGITAL NOTIFICATION SOUNDS', 'TATTLE', 'GROUP WITHIN A GROUP', 'MICROSOFT PRODUCTS']"
2023-11-08,"YO-YO, FLIP-FLOP, BREEZE, MULE, SHOESTRING, UMBRELLA, HEDGE, SEE-SAW, TOWEL, RUSSIAN, CURLY, SUNSCREEN, WEDGE, WAVER, WAFFLE, MARY","[['FLIP-FLOP', 'SUNSCREEN', 'TOWEL', 'UMBRELLA'], ['CURLY', 'SHOESTRING', 'WAFFLE', 'WEDGE'], ['HEDGE', 'SEE-SAW', 'WAVER', 'YO-YO'], ['BREEZE', 'MARY', 'MULE', 'RUSSIAN']]","['BROUGHT TO THE BEACH', 'TYPES OF FRENCH FRIES', 'EQUIVOCATE', 'SECOND WORDS OF VODKA COCKTAILS']"
2023-11-09,"SKETCH, DIET, RADIOLAB, DIVINE, FRESH AIR, EXERCISE, SLEEP, SEND, SERIAL, PROP, REPLY ALL, BLACK, FORWARD, UP FIRST, WTF, COMPOSE","[['DIET', 'EXERCISE', 'FRESH AIR', 'SLEEP'], ['COMPOSE', 'FORWARD', 'REPLY ALL', 'SEND'], ['RADIOLAB', 'SERIAL', 'UP FIRST', 'WTF'], ['BLACK', 'DIVINE', 'PROP', 'SKETCH']]","['DOCTORS’ ORDERS', 'EMAIL ACTIONS', 'PODCASTS', '___ COMEDY']"
2023-11-10,"BRIGHT, MACE, CLUB, SAGE, NUTMEG, SWORD, QUICK, SPEAR, DEGREE, ANISE, AXE, OLD SPICE, SECRET, SMART, DILL, SHARP","[['ANISE', 'DILL', 'NUTMEG', 'SAGE'], ['BRIGHT', 'QUICK', 'SHARP', 'SMART'], ['AXE', 'DEGREE', 'OLD SPICE', 'SECRET'], ['CLUB', 'MACE', 'SPEAR', 'SWORD']]","['SPICES', 'INTELLIGENT', 'DEODORANTS', 'MEDIEVAL WEAPONS']"
2023-11-11,"BLAST, LIFE, SPARE, DOLLY, KICK, TRIPOD, CLUE, GRIP, THIN, LENS, BOOM, ROOM, BALL, SHORT, RIOT, LIGHT","[['LIGHT', 'SHORT', 'SPARE', 'THIN'], ['BALL', 'BLAST', 'KICK', 'RIOT'], ['BOOM', 'DOLLY', 'LENS', 'TRIPOD'], ['CLUE', 'GRIP', 'LIFE', 'ROOM']]","['SPARSE/LACKING', 'FUN TIME', 'FILMMAKING EQUIPMENT', '“GET A ___!”']"
2023-11-12,"LINCOLN, HONDA, COACH, SEMI, SUB, JAGUAR, PLAYER, AUTO, WILSON, GRANT, BMW, GM, FORD, SCOUT, SUBARU, POST","[['FORD', 'GRANT', 'LINCOLN', 'WILSON'], ['COACH', 'GM', 'PLAYER', 'SCOUT'], ['BMW', 'HONDA', 'JAGUAR', 'SUBARU'], ['AUTO', 'POST', 'SEMI', 'SUB']]","['PRESIDENTS', 'SPORTS PROFESSIONALS', 'CAR COMPANIES', 'COMMON PREFIXES']"
2023-11-13,"FEATURE, CARD, TRAIT, BOOK, JOKER, STAMP, HALLMARK, TABLE, WORD, CUTUP, TEA, TREE, CLOWN, SENTENCE, LETTER, PARAGRAPH","[['LETTER', 'PARAGRAPH', 'SENTENCE', 'WORD'], ['FEATURE', 'HALLMARK', 'STAMP', 'TRAIT'], ['CARD', 'CLOWN', 'CUTUP', 'JOKER'], ['BOOK', 'TABLE', 'TEA', 'TREE']]","['UNIT OF LANGUAGE', 'TRADEMARK', 'FUNNY PERSON', 'THINGS WITH LEAVES']"
2023-11-14,"TADA, WIN, FEAR, PRESTO, RED, GET, CARPENTER, SECURE, VOILA, FIRE, ADAM, ANGER, SURPRISE, HAPPINESS, LAND, BEHOLD","[['ANGER', 'FEAR', 'HAPPINESS', 'SURPRISE'], ['BEHOLD', 'PRESTO', 'TADA', 'VOILA'], ['GET', 'LAND', 'SECURE', 'WIN'], ['ADAM', 'CARPENTER', 'FIRE', 'RED']]","['BASIC EMOTIONS', 'BIT OF VOCAL FANFARE', 'OBTAIN', '___ ANT']"
2023-11-15,"WII, UGH, O, EW, DA, WEE, WE, US, SI, JA, W, OK, ICK, OUI, PU, HAI","[['EW', 'ICK', 'PU', 'UGH'], ['O', 'OK', 'US', 'W'], ['HAI', 'JA', 'SI', 'DA'], ['OUI', 'WE', 'WEE', 'WII']]","['“GROSS!”', 'MAGAZINES', '“YES” IN DIFFERENT LANGUAGES', 'HOMOPHONES']"
2023-11-16,"SEAL, HOGWASH, NONSENSE, DIRECT, BULL, DEER, FISH, ROT, DANE, WHITE, GUIDE, LEAD, LAKE, MOOSE, STEER, BUFFALO","[['BULL', 'HOGWASH', 'NONSENSE', 'ROT'], ['DIRECT', 'GUIDE', 'LEAD', 'STEER'], ['BUFFALO', 'DEER', 'FISH', 'MOOSE'], ['DANE', 'LAKE', 'SEAL', 'WHITE']]","['BALDERDASH', 'HELM', 'SINGLE/PLURAL ANIMALS', 'GREAT ___']"
2023-11-17,"BEST, BANKS, LUNGES, DIPS, SQUATS, MOSS, WARREN, TAYLOR, JAYS, YANKS, PLANKS, THANKS, REGARDS, CARDS, CHEERS, NATS","[['DIPS', 'LUNGES', 'PLANKS', 'SQUATS'], ['BEST', 'CHEERS', 'REGARDS', 'THANKS'], ['CARDS', 'JAYS', 'NATS', 'YANKS'], ['BANKS', 'MOSS', 'TAYLOR', 'WARREN']]","['BODYWEIGHT EXERCISES', 'EMAIL SIGN-OFFS', 'M.L.B. TEAMS, FOR SHORT', 'ELIZABETHS (AND ONE ELISABETH)']"
2023-11-18,"PEEK, PEAK, CRAG, LOOK, CHARADE, PIQUE, BLUFF, FRONT, GLIMPSE, RIDGE, GANDER, ACT, CLIFF, PEKE, GLANCE, LEDGE","[['GANDER', 'GLANCE', 'GLIMPSE', 'LOOK'], ['ACT', 'BLUFF', 'CHARADE', 'FRONT'], ['CLIFF', 'CRAG', 'LEDGE', 'RIDGE'], ['PEAK', 'PEEK', 'PEKE', 'PIQUE']]","['QUICK PEEK', 'DECEIT', 'PARTS OF A MOUNTAIN', 'HOMOPHONES']"
2023-11-19,"GROUNDHOG, CREATION, START, EARTH, AUGUST, GRAND, BIRTH, TREAD, NOBLE, DAWN, MAY, STEP, MARCH, LABOR, REGAL, STRIDE","[['BIRTH', 'CREATION', 'DAWN', 'START'], ['AUGUST', 'GRAND', 'NOBLE', 'REGAL'], ['MARCH', 'STEP', 'STRIDE', 'TREAD'], ['EARTH', 'GROUNDHOG', 'LABOR', 'MAY']]","['ONSET', 'VENERABLE', 'WALK', '___ DAY HOLIDAYS']"
2023-11-20,"MIRROR, MONK, MINT, TOMATO, GIBBON, BABOON, PASTOR, MIME, LAMA, GORILLA, PARROT, CARDINAL, TAMARIND, BONOBO, MANGO, APE","[['CARDINAL', 'LAMA', 'MONK', 'PASTOR'], ['BABOON', 'BONOBO', 'GIBBON', 'GORILLA'], ['MANGO', 'MINT', 'TAMARIND', 'TOMATO'], ['APE', 'MIME', 'MIRROR', 'PARROT']]","['RELIGIOUS FIGURES', 'PRIMATES', 'CHUTNEY VARIETIES', 'IMITATE']"
2023-11-21,"TUSK, VAMPIRE, CHIC, FANG, LEECH, WORM, HIP, STRAW, ROBOT, CANINE, FLOSS, VOGUE, IN, MOLAR, HOT, VACUUM","[['CANINE', 'FANG', 'MOLAR', 'TUSK'], ['CHIC', 'HIP', 'HOT', 'IN'], ['FLOSS', 'ROBOT', 'VOGUE', 'WORM'], ['LEECH', 'STRAW', 'VACUUM', 'VAMPIRE']]","['TYPES OF TEETH', 'FASHIONABLE', 'DANCE MOVES', 'THINGS THAT SUCK']"
2023-11-22,"CANYON, COWL, CHEN, CLARK, GULCH, GORGE, MIRROR, BASHFUL, CRAVEN, SCARF, RAVINE, WOLF, GULP, QUEEN, PASS, APPLE","[['CANYON', 'GULCH', 'PASS', 'RAVINE'], ['GORGE', 'GULP', 'SCARF', 'WOLF'], ['APPLE', 'BASHFUL', 'MIRROR', 'QUEEN'], ['CHEN', 'CLARK', 'COWL', 'CRAVEN']]","['AREAS BETWEEN MOUNTAINS AND HILLS', 'EAT VORACIOUSLY', 'FEATURED IN “SNOW WHITE”', '“C” + BIRD']"
2023-11-23,"RAPPORT, TART, JAPAN, TURNOVER, BOUQUET, POLAND, TURKEY, JAMES, PIE, PARFAIT, CURRY, RAGOUT, PASTY, JORDAN, BIRD, TUNISIA","[['PASTY', 'PIE', 'TART', 'TURNOVER'], ['BOUQUET', 'PARFAIT', 'RAGOUT', 'RAPPORT'], ['JAPAN', 'POLAND', 'TUNISIA', 'TURKEY'], ['BIRD', 'CURRY', 'JAMES', 'JORDAN']]","['FOODS WITH CRUSTS', 'ENDING IN A SILENT “T”', 'COUNTRIES WITH RED AND WHITE FLAGS', 'N.B.A. GREATS']"
2023-11-24,"KNOCK, ROAST, MINI, ALONE, BACHELOR, JAGUAR, CATFISH, PAN, SURVIVOR, RAM, SLAM, FIAT, CHOPPED, MOUSE, LILY, MAXI","[['KNOCK', 'PAN', 'ROAST', 'SLAM'], ['ALONE', 'CATFISH', 'CHOPPED', 'SURVIVOR'], ['FIAT', 'JAGUAR', 'MINI', 'RAM'], ['BACHELOR', 'LILY', 'MAXI', 'MOUSE']]","['CRITICIZE', 'REALITY SHOWS', 'CAR BRANDS', '___ PAD']"
2023-11-25,"STRAIT, CHANNEL, 96, REMOTE, NOON, QUANTITY, CANAL, NUMBER, MOW, AMOUNT, SIS, PRIVATE, SOUND, VOLUME, SECRET, HIDDEN","[['HIDDEN', 'PRIVATE', 'REMOTE', 'SECRET'], ['AMOUNT', 'NUMBER', 'QUANTITY', 'VOLUME'], ['CANAL', 'CHANNEL', 'SOUND', 'STRAIT'], ['96', 'MOW', 'NOON', 'SIS']]","['SECLUDED', 'AGGREGATE SIZE', 'BODIES OF WATER', 'READS THE SAME ROTATED 180°']"
2023-11-26,"JUSTICE, CAPITAL, INTEREST, STOCK, COUNTY, LITTLE, TOWN, CHOP, CITY, PULSE, PUREE, PREMIER, VILLAGE, GRIND, EQUITY, IVY","[['CITY', 'COUNTY', 'TOWN', 'VILLAGE'], ['CHOP', 'GRIND', 'PULSE', 'PUREE'], ['CAPITAL', 'EQUITY', 'INTEREST', 'STOCK'], ['IVY', 'JUSTICE', 'LITTLE', 'PREMIER']]","['MUNICIPALITIES', 'BLENDER BUTTONS', 'FINANCIAL TERMS', '___ LEAGUE']"
2023-11-27,"LIME, STICK, GROSS, SCAT, GUM, TAPE, WHISTLE, SODA, SING, MINT, GLUE, HUM, RUM, COUNT, TOTAL, SUM","[['HUM', 'SING', 'SCAT', 'WHISTLE'], ['COUNT', 'GROSS', 'SUM', 'TOTAL'], ['LIME', 'MINT', 'RUM', 'SODA'], ['GLUE', 'GUM', 'TAPE', 'STICK']]","['CARRY A TUNE', 'WHOLE AMOUNT', 'MOJITO INGREDIENTS', 'THINGS THAT ARE “STICKY”']"
2023-11-28,"JAM, PACK, ISLAND, BEDROOM, ATOLL, CRAM, KEY, KITCHEN, SPROUT, STUFF, DEN, BAR, BAG, COUNTER, STUDY, DIP","[['BEDROOM', 'DEN', 'KITCHEN', 'STUDY'], ['ATOLL', 'BAR', 'ISLAND', 'KEY'], ['CRAM', 'JAM', 'PACK', 'STUFF'], ['BAG', 'COUNTER', 'DIP', 'SPROUT']]","['ROOMS IN A HOUSE', 'LAND SURROUNDED BY WATER', 'FILL TO EXCESS', 'BEAN ___']"
2023-11-29,"SNAKE, SIT, SOLE, HARP, COME, DOG, DOWN, JERK, HEEL, BASS, TOE, STAY, HORN, BALL, ORGAN, ARCH","[['ARCH', 'BALL', 'SOLE', 'TOE'], ['BASS', 'HARP', 'HORN', 'ORGAN'], ['COME', 'DOWN', 'SIT', 'STAY'], ['DOG', 'HEEL', 'JERK', 'SNAKE']]","['FOOT PARTS', 'MUSICAL INSTRUMENTS', 'DOG COMMANDS', 'BADDIE']"
2023-11-30,"ROPE, DUCK, NOTORIOUS, CREAM, HOBBES, ROBIN, STRING, ESCAPE, SAY, WATSON, DODGE, REBECCA, COTTAGE, BIRDS, SKIRT, GOOSE","[['DODGE', 'DUCK', 'ESCAPE', 'SKIRT'], ['BIRDS', 'NOTORIOUS', 'REBECCA', 'ROPE'], ['GOOSE', 'HOBBES', 'ROBIN', 'WATSON'], ['COTTAGE', 'CREAM', 'SAY', 'STRING']]","['AVOID', 'HITCHCOCK MOVIES', 'SIDEKICKS', '___ CHEESE']"
2023-12-01,"SHARE, OUTLET, MONKEY, ALLEN, TAKE, SOCKET, SHAVE, CRESCENT, WAX, MALL, MARKET, THREAD, PIECE, STORE, TWEEZE, CUT","[['MALL', 'MARKET', 'OUTLET', 'STORE'], ['SHAVE', 'THREAD', 'TWEEZE', 'WAX'], ['CUT', 'PIECE', 'SHARE', 'TAKE'], ['ALLEN', 'CRESCENT', 'MONKEY', 'SOCKET']]","['PLACES TO SHOP', 'WAYS TO REMOVE HAIR', 'PORTION OF PROFIT', 'KINDS OF WRENCHES']"
2023-12-02,"HOOP, CIRCLE, NBA, BASKET, CHECK, BIN, PEARL, CURB, HAMPER, PAPER, CHEST, BAND, CAP, RING, LIMIT, TRAFFIC","[['BASKET', 'BIN', 'CHEST', 'HAMPER'], ['BAND', 'CIRCLE', 'HOOP', 'RING'], ['CAP', 'CHECK', 'CURB', 'LIMIT'], ['NBA', 'PAPER', 'PEARL', 'TRAFFIC']]","['CONTAINERS', 'CIRCULAR SHAPES', 'RESTRICT', '___ JAM']"
2023-12-03,"HEARD, ACOUSTIC, AMP, FIRE, ELECTRIC, PUMP, GAS, AUDITORY, HITCH, COUPLE, HYPE, CABLE, LINK, WATER, SONIC, TIE","[['CABLE', 'ELECTRIC', 'GAS', 'WATER'], ['ACOUSTIC', 'AUDITORY', 'HEARD', 'SONIC'], ['COUPLE', 'HITCH', 'LINK', 'TIE'], ['AMP', 'FIRE', 'HYPE', 'PUMP']]","['MONTHLY BILLS', 'RELATED TO SOUND/HEARING', 'CONNECT', 'EXCITE, WITH “UP”']"
2023-12-04,"CHIP, NICK, LOAF, GUARANTEE, CLINCH, BAGUETTE, STATE, SCRATCH, SECURE, MARK, LETTUCE, STEAM, ROLL, LOCK, HAIR, BUN","[['BAGUETTE', 'BUN', 'LOAF', 'ROLL'], ['CLINCH', 'GUARANTEE', 'LOCK', 'SECURE'], ['CHIP', 'MARK', 'NICK', 'SCRATCH'], ['HAIR', 'LETTUCE', 'STATE', 'STEAM']]","['UNIT OF BREAD', 'ASSURE, AS A WIN', 'SMALL IMPERFECTION', 'HEAD OF ___']"
2023-12-05,"PAPER, GREAT, CONSTRUCTION, FICTION, EUPHORIA, GLEE, POETRY, HUMOR, TRAVEL, WHOOPING, FRASIER, HUGE, BIG, FELICITY, CHEERS, GIANT","[['BIG', 'GIANT', 'GREAT', 'HUGE'], ['FICTION', 'HUMOR', 'POETRY', 'TRAVEL'], ['CHEERS', 'EUPHORIA', 'FELICITY', 'GLEE'], ['CONSTRUCTION', 'FRASIER', 'PAPER', 'WHOOPING']]","['ENORMOUS', 'BOOKSTORE SECTIONS', 'TV SHOWS WITH HAPPY-SOUNDING NAMES', '___ CRANE']"
2023-12-06,"SCALES, TWINS, CRAB, CAPITOL, BULL, VIRGIN, REST, TAU, COLUMBIA, GEM, CLEF, NOTE, ISLAND, LIB, CAN, STAFF","[['CLEF', 'NOTE', 'REST', 'STAFF'], ['BULL', 'CRAB', 'SCALES', 'TWINS'], ['CAPITOL', 'COLUMBIA', 'VIRGIN', 'ISLAND'], ['CAN', 'GEM', 'LIB', 'TAU']]","['FOUND ON SHEET MUSIC', 'ZODIAC SYMBOLS', 'RECORD LABELS', 'ZODIAC SIGN BEGINNINGS']"
2023-12-07,"POM, OK, ROMEO, HALLMARK, BRAVO, MA, TOM, YO, ALFA, BOO, BET, TANGO, HI, LA, USA, E","[['HI', 'LA', 'MA', 'OK'], ['BET', 'E', 'HALLMARK', 'USA'], ['ALFA', 'BRAVO', 'ROMEO', 'TANGO'], ['BOO', 'POM', 'TOM', 'YO']]","['STATE ABBREVIATIONS', 'CABLE CHANNELS', 'IN THE NATO ALPHABET', '___-___']"
2023-12-08,"EBB, FLAG, WANE, SHEER, AIR, STARK, BANNER, PURE, UTTER, WAYNE, VOICE, FADE, STATE, PRINCE, TOTAL, SPEAK","[['EBB', 'FADE', 'FLAG', 'WANE'], ['PURE', 'SHEER', 'TOTAL', 'UTTER'], ['AIR', 'SPEAK', 'STATE', 'VOICE'], ['BANNER', 'PRINCE', 'STARK', 'WAYNE']]","['DECLINE', 'ABSOLUTE', 'EXPRESS', 'SUPERHERO LAST NAMES']"
2023-12-09,"WICKET, NOTE, PALM, RIVET, SPLIT, FINGERS, CORN, NAIL, FLOAT, PEANUT, RICE, SCREW, BOLT, SHAKE, SUNDAE, OLIVE","[['FLOAT', 'SHAKE', 'SPLIT', 'SUNDAE'], ['BOLT', 'NAIL', 'RIVET', 'SCREW'], ['CORN', 'OLIVE', 'PALM', 'PEANUT'], ['FINGERS', 'NOTE', 'RICE', 'WICKET']]","['ICE CREAM TREATS', 'HARDWARE FASTENERS', 'KINDS OF COOKING OIL', 'STICKY ___']"
2023-12-10,"BED, COIL, CINCH, SPIRAL, TWIST, LEAP, PICNIC, DELTA, VAULT, MOUTH, BREEZE, BANK, SNAP, BOUND, WIND, SPRING","[['BANK', 'BED', 'DELTA', 'MOUTH'], ['BREEZE', 'CINCH', 'PICNIC', 'SNAP'], ['COIL', 'SPIRAL', 'TWIST', 'WIND'], ['BOUND', 'LEAP', 'SPRING', 'VAULT']]","['PARTS OF A RIVER', 'SOMETHING EASY TO DO', 'WRAP AROUND IN A CIRCLE', 'JUMP INTO THE AIR']"
2023-12-11,"SATIN, LACE, BABY, SOLE, PACKAGE, PERCH, TONGUE, ROOST, LAND, BLOW, SPEECH, SETTLE, VELVET, SILK, CHIFFON, EYELET","[['CHIFFON', 'SATIN', 'SILK', 'VELVET'], ['PERCH', 'ROOST', 'SETTLE', 'LAND'], ['EYELET', 'LACE', 'SOLE', 'TONGUE'], ['BABY', 'BLOW', 'PACKAGE', 'SPEECH']]","['LUXURIOUS FABRICS', 'COME DOWN TO REST', 'SHOE PARTS', 'THINGS THAT ARE DELIVERED']"
2023-12-12,"HAZE, PLUNGER, SHADOW, ICE, IRE, GREEN, TRACK, TAIL, MIST, FOG, CLOUD, BUMPER, FLIPPER, FIN, BALL, TRAIL","[['CLOUD', 'FOG', 'HAZE', 'MIST'], ['SHADOW', 'TAIL', 'TRACK', 'TRAIL'], ['BALL', 'BUMPER', 'FLIPPER', 'PLUNGER'], ['FIN', 'GREEN', 'ICE', 'IRE']]","['MURKY CONDITION', 'FOLLOW', 'PINBALL MACHINE COMPONENTS', '___LAND']"
2023-12-13,"STOP, BLUE, UNCLE, BOUGH, ENOUGH, BUNKER, COUGH, MERCY, DOUGH, GREEN, TOUGH, RISQUE, ROUGH, FAIRWAY, BAWDY, COARSE","[['BUNKER', 'FAIRWAY', 'GREEN', 'ROUGH'], ['ENOUGH', 'MERCY', 'STOP', 'UNCLE'], ['BAWDY', 'BLUE', 'COARSE', 'RISQUE'], ['BOUGH', 'COUGH', 'DOUGH', 'TOUGH']]","['GOLF COURSE PARTS', '“I GIVE!”', 'INDECENT', '”-OUGH” WORDS THAT DON’T RHYME']"
2023-12-14,"NAG, LINING, BADGER, BUG, FORK, HOUND, DOME, SCREEN, FIELD, FOX, PART, BOWL, SPLIT, ARENA, DIVIDE, SPOON","[['BADGER', 'BUG', 'HOUND', 'NAG'], ['ARENA', 'BOWL', 'DOME', 'FIELD'], ['DIVIDE', 'FORK', 'PART', 'SPLIT'], ['FOX', 'LINING', 'SCREEN', 'SPOON']]","['PESTER', 'SPORTS VENUES', 'SEPARATE', 'SILVER ___']"
2023-12-15,"CHEAT, CRANK, GRUMP, QUACK, CROUCH, DUCK, SEAL, FLAG, SQUAT, ANTHEM, GROUCH, STOOP, SHARK, CROOK, MOTTO, CRAB","[['CRAB', 'CRANK', 'GROUCH', 'GRUMP'], ['CROUCH', 'DUCK', 'SQUAT', 'STOOP'], ['ANTHEM', 'FLAG', 'MOTTO', 'SEAL'], ['CHEAT', 'CROOK', 'QUACK', 'SHARK']]","['CURMUDGEON', 'GET LOW', 'NATIONAL SYMBOLS', 'SWINDLER']"
2023-12-16,"PLEASE, THUD, PLOT, SPLASH, DELIGHT, PLOY, RAKE, AMUSE, HOE, SICKLE, TRICK, BANG, PLOP, RUSE, PLOW, TICKLE","[['HOE', 'PLOW', 'RAKE', 'SICKLE'], ['PLOT', 'PLOY', 'RUSE', 'TRICK'], ['AMUSE', 'DELIGHT', 'PLEASE', 'TICKLE'], ['BANG', 'PLOP', 'SPLASH', 'THUD']]","['FARM TOOLS', 'SCHEME', 'MAKE HAPPY', 'ONOMATOPOEIA']"
2023-12-17,"GIRL, STASH, SNOW, SAVE, PAGES, NERVE, GUTS, BUSINESS, COAL, STORE, BONE, STICKS, STONES, BANK, GALL, CARROT","[['BANK', 'SAVE', 'STASH', 'STORE'], ['GALL', 'GUTS', 'NERVE', 'STONES'], ['CARROT', 'COAL', 'SNOW', 'STICKS'], ['BONE', 'BUSINESS', 'GIRL', 'PAGES']]","['RESERVE FOR LATER', 'BOLDNESS, FIGURATIVELY', 'USED TO BUILD A SNOWMAN', 'FUNNY ___']"
2023-12-18,"WINK, FIRST, CHIEF, FIFTH, MAIN, PRINCIPAL, RUSH, ELEVENTH, AMATEUR, BROADWAY, FLASH, HAPPY, MADISON, PARK, JIFFY, SECOND","[['FLASH', 'JIFFY', 'SECOND', 'WINK'], ['CHIEF', 'FIRST', 'MAIN', 'PRINCIPAL'], ['BROADWAY', 'FIFTH', 'MADISON', 'PARK'], ['AMATEUR', 'ELEVENTH', 'HAPPY', 'RUSH']]","['BRIEF MOMENT', 'PRIMARY', 'AVENUES IN N.Y.C.', '___ HOUR']"
2023-12-19,"STONE, OFTEN, SKETCH, DRAW, ROUTINE, FREIGHT, CANINE, APPEAL, PULL, WATCH, JOKE, BIT, BRACELET, TIE, CHARM, BELT","[['BELT', 'BRACELET', 'TIE', 'WATCH'], ['BIT', 'JOKE', 'ROUTINE', 'SKETCH'], ['APPEAL', 'CHARM', 'DRAW', 'PULL'], ['CANINE', 'FREIGHT', 'OFTEN', 'STONE']]","['ACCESSORIES', 'COMEDIAN’S OUTPUT', 'ATTRACTION', 'TWO LETTERS + NUMBER']"
2023-12-20,"LITTLE, DINKY, PREFACE, ITCHY, SPEEDY, SLIGHT, CHAPTER, DIAL, INDEX, APPENDIX, PINKY, CALL, JERRY, MINUTE, BUZZ, RING","[['BUZZ', 'CALL', 'DIAL', 'RING'], ['APPENDIX', 'CHAPTER', 'INDEX', 'PREFACE'], ['DINKY', 'LITTLE', 'MINUTE', 'SLIGHT'], ['ITCHY', 'JERRY', 'PINKY', 'SPEEDY']]","['CONTACT VIA PHONE', 'BOOK SECTIONS', 'WEE', 'CARTOON MICE']"
2023-12-21,"DRYER, HAMPER, WASHER, HIDDEN, STEER, DEATH, LEAD, MYSELF, UNCANNY, SILICON, GUIDE, IRON, IOTA, ONE, DIRECT, IODINE","[['DRYER', 'HAMPER', 'IRON', 'WASHER'], ['DIRECT', 'GUIDE', 'LEAD', 'STEER'], ['IODINE', 'IOTA', 'MYSELF', 'ONE'], ['DEATH', 'HIDDEN', 'SILICON', 'UNCANNY']]","['SEEN IN A LAUNDRY ROOM', 'SHEPHERD', 'WHAT “I” MIGHT MEAN', '___ VALLEY']"
2023-12-22,"WAIL, COMB, DEAR, HOARSE, STRETCH, WITCH, ANGEL, PIRATE, HONEY, PERIOD, CLOWN, SPELL, HAIR, HIVE, WHILE, WAX","[['ANGEL', 'CLOWN', 'PIRATE', 'WITCH'], ['COMB', 'HIVE', 'HONEY', 'WAX'], ['PERIOD', 'SPELL', 'STRETCH', 'WHILE'], ['DEAR', 'HAIR', 'HOARSE', 'WAIL']]","['CLASSIC HALLOWEEN COSTUMES', 'BEE CREATIONS', 'INTERVAL OF TIME', 'ANIMAL HOMOPHONES']"
2023-12-23,"PLANE, CAR, ON BOARD, IN, DOWN, BOAT, DROP, RASP, TRAIN, GOOSE, PINCH, STRAW, GAME, SPLASH, DASH, BLUE","[['BOAT', 'CAR', 'PLANE', 'TRAIN'], ['DOWN', 'GAME', 'IN', 'ON BOARD'], ['DASH', 'DROP', 'PINCH', 'SPLASH'], ['BLUE', 'GOOSE', 'RASP', 'STRAW']]","['MEANS OF TRANSPORTATION', 'WILLING TO PARTICIPATE', 'LITTLE BIT, IN A RECIPE', '___BERRY ']"
2023-12-24,"TABLET, HOCK, EYELASH, DANDELION, MELLOW, SHOULDER, CANDLE, MILD, LIGHT, ROBE, CHOP, TORCH, CROWN, DICE, SOFT, BELLY","[['LIGHT', 'MELLOW', 'MILD', 'SOFT'], ['BELLY', 'CHOP', 'HOCK', 'SHOULDER'], ['CROWN', 'ROBE', 'TABLET', 'TORCH'], ['CANDLE', 'DANDELION', 'DICE', 'EYELASH']]","['GENTLE', 'CUTS OF PORK', 'STATUE OF LIBERTY FEATURES', 'THINGS TO BLOW ON FOR WISHES/LUCK']"
2023-12-25,"CODE, BOO, POINT, ZIP, RAY, LINE, FIRE, DEAR, SANTA, SEGMENT, ENERGY, BABY, JUICE, LOVE, SAUCE, AGENT","[['BABY', 'BOO', 'DEAR', 'LOVE'], ['LINE', 'POINT', 'RAY', 'SEGMENT'], ['ENERGY', 'FIRE', 'JUICE', 'ZIP'], ['AGENT', 'CODE', 'SANTA', 'SAUCE']]","['DARLING', 'BASIC GEOMETRIC OBJECTS', 'OOMPH', 'SECRET ___']"
2023-12-26,"HOLD, CURB, PAGE, LIMIT, LEAF, LANE, PICK, SHEET, DRIVE, STEM, ALLEY, BLOW, STREET, CHECK, THUMB, FOLIO","[['ALLEY', 'DRIVE', 'LANE', 'STREET'], ['FOLIO', 'LEAF', 'PAGE', 'SHEET'], ['CHECK', 'CURB', 'LIMIT', 'STEM'], ['BLOW', 'HOLD', 'PICK', 'THUMB']]","['ROAD NAMES', 'PAPER IN A BOOK', 'RESTRAIN', 'THINGS YOU CAN DO TO YOUR NOSE']"
2023-12-27,"REV, DR, WARNING, GEN, INK, MESSAGE, PAINT, SIGN, PASTEL, BLACK, CHARCOAL, GHOST, PROF, OMEN, MS, BELL","[['MESSAGE', 'OMEN', 'SIGN', 'WARNING'], ['GEN', 'MS', 'PROF', 'REV'], ['CHARCOAL', 'INK', 'PAINT', 'PASTEL'], ['BELL', 'BLACK', 'DR', 'GHOST']]","['INDICATION OF THINGS TO COME', 'NAME PREFIXES', 'ART MEDIUMS', '___ PEPPER']"
2023-12-28,"TRUNK, MONK, DART, ZIP, LARK, DASH, JAY, SWIFT, HOOD, PARKER, HANCOCK, BOLT, TIRE, CARDINAL, BUMPER, HOLIDAY","[['BUMPER', 'HOOD', 'TIRE', 'TRUNK'], ['BOLT', 'DART', 'DASH', 'ZIP'], ['CARDINAL', 'JAY', 'LARK', 'SWIFT'], ['HANCOCK', 'HOLIDAY', 'MONK', 'PARKER']]","['PARTS OF A CAR', 'MOVE QUICKLY', 'BIRDS', 'JAZZ LEGENDS']"
2023-12-29,"BAD, TEE, CURIOUS, FLY, JAY, BY, EX, RAD, SAINT, POLO, BOY, GEE, TANK, FRESH, CROP, BEE","[['CROP', 'POLO', 'TANK', 'TEE'], ['BAD', 'FLY', 'FRESH', 'RAD'], ['BEE', 'EX', 'GEE', 'JAY'], ['BOY', 'BY', 'CURIOUS', 'SAINT']]","['SHIRTS', 'COOL, IN ’80S SLANG', 'LETTER SPELLINGS', '___ GEORGE']"
2023-12-30,"SAND, CHAIN, SPEED, WIND, SKUNK, TOURIST, DESERT, SERIES, TRAIN, BASS, BEAR, PANDA, ZEBRA, DOVE, STRING, ORCA","[['ORCA', 'PANDA', 'SKUNK', 'ZEBRA'], ['CHAIN', 'SERIES', 'STRING', 'TRAIN'], ['BASS', 'DOVE', 'DESERT', 'WIND'], ['BEAR', 'SAND', 'SPEED', 'TOURIST']]","['BLACK-AND-WHITE ANIMALS', 'SEQUENCE', 'HETERONYMS', '___ TRAP']"
2023-12-31,"RESOLUTION, PARTY, DEFINITION, CLUB, DETAIL, TOURS, FIREWORKS, CHAMPAGNE, COUNTDOWN, DIJON, CLARITY, BALL, KISS, GROUP, NICE, TEAM","[['CLUB', 'GROUP', 'PARTY', 'TEAM'], ['CLARITY', 'DEFINITION', 'DETAIL', 'RESOLUTION'], ['CHAMPAGNE', 'DIJON', 'NICE', 'TOURS'], ['BALL', 'COUNTDOWN', 'FIREWORKS', 'KISS']]","['ORGANIZATION', 'SHARPNESS, AS OF AN IMAGE', 'PLACES IN FRANCE', 'HAPPY NEW YEAR!']"
2024-01-01,"WEE, GREEN, PLANT, PYRAMID, WEDGE, MILLIONAIRE, SEED, WHY, WHOA, CAESAR, GREEK, FEUD, WHEEL, WEED, WAY, WATER","[['PLANT', 'SEED', 'WATER', 'WEED'], ['CAESAR', 'GREEK', 'GREEN', 'WEDGE'], ['FEUD', 'MILLIONAIRE', 'PYRAMID', 'WHEEL'], ['WAY', 'WEE', 'WHY', 'WHOA']]","['GARDENING NOUNS/VERBS', 'KINDS OF SALADS', 'CLASSIC GAME SHOWS, FAMILIARLY', 'W + VOWEL SOUND']"
2024-01-02,"WONDER, CLOG, BACON, FRY, DOUBLE, WORLD, BLOCK, RUN, JAM, STOP, TOMATO, HIT, BREAD, WALK, TALK, LETTUCE","[['BREAD', 'BACON', 'LETTUCE', 'TOMATO'], ['BLOCK', 'CLOG', 'JAM', 'STOP'], ['DOUBLE', 'HIT', 'RUN', 'WALK'], ['FRY', 'TALK', 'WONDER', 'WORLD']]","['B.L.T. INGREDIENTS', 'OBSTRUCT', 'BASEBALL STATS', 'SMALL ___']"
2024-01-03,"MIKE, MARK, CHECK, WIRE, SOAR, TICK, COLE, GLIDE, TAP, PAIN, BUG, FLY, FLOAT, X, TIP, 40","[['FLOAT', 'FLY', 'GLIDE', 'SOAR'], ['BUG', 'MIKE', 'TAP', 'WIRE'], ['CHECK', 'MARK', 'TICK', 'X'], ['40', 'COLE', 'PAIN', 'TIP']]","['MOVE THROUGH THE AIR', 'HIDDEN LISTENING DEVICES', 'SELECT, AS A BOX ON A FORM', 'RAPPERS MINUS FIRST LETTER']"
2024-01-04,"BREAK, SWIPE, CHARM, WRAPPING, FIRE, MESSAGE, LIT, DUCK, SICK, STRIKE, TIGHT, CARD, BOW, MATCH, BLOCK, BOX","[['BOW', 'BOX', 'CARD', 'WRAPPING'], ['BLOCK', 'MATCH', 'MESSAGE', 'SWIPE'], ['FIRE', 'LIT', 'SICK', 'TIGHT'], ['BREAK', 'CHARM', 'DUCK', 'STRIKE']]","['GIFT-GIVING ACCESSORIES', 'DATING APP ACTIONS', 'COOL, IN SLANG', 'LUCKY ___']"
2024-01-05,"PEAK, TEN, JOSH, ADULT, DOZEN, RIB, TIMES, MAX, TOP, TEASE, GROSS, KISS, KID, PAIR, SCORE, HEIGHT","[['JOSH', 'KID', 'RIB', 'TEASE'], ['HEIGHT', 'MAX', 'PEAK', 'TOP'], ['DOZEN', 'GROSS', 'PAIR', 'SCORE'], ['ADULT', 'KISS', 'TEN', 'TIMES']]","['PLAYFULLY BOTHER', 'APEX', 'WORDS FOR SPECIFIC QUANTITIES', 'WHAT “X” MIGHT MEAN']"
2024-01-06,"BONE, ODOR, FIGHT, SWAY, FOUL, WAVE, CRYSTAL, LOCK, TANG, FUNK, GUTTER, ROCK, AFRO, DISCO, MUSK, SWING","[['FUNK', 'MUSK', 'ODOR', 'TANG'], ['ROCK', 'SWAY', 'SWING', 'WAVE'], ['AFRO', 'BONE', 'FIGHT', 'LOCK'], ['CRYSTAL', 'DISCO', 'FOUL', 'GUTTER']]","['STRONG SMELL', 'MOVE BACK AND FORTH', 'THINGS TO PICK', '___ BALL']"
2024-01-07,"SWEET, APPLE, EYE, BABY, FINAL, PHYSICAL, BAR, AMAZON, PEACH, BEAUTY, WISDOM, GEM, ORAL, ALPHABET, MARVEL, META","[['ALPHABET', 'AMAZON', 'APPLE', 'META'], ['BAR', 'FINAL', 'ORAL', 'PHYSICAL'], ['BEAUTY', 'GEM', 'MARVEL', 'PEACH'], ['BABY', 'EYE', 'SWEET', 'WISDOM']]","['TECH COMPANIES', 'KINDS OF EXAMS', 'SOMETHING EXEMPLARY', '___ TOOTH']"
2024-01-08,"TEE, CART, BASKETBALL, STICK, POLE, ROD, CIRCLE, CARROT, TRIANGLE, PITCHFORK, HOLE, STAFF, GOLDFISH, PUMPKIN, CLUB, HORSESHOE","[['BASKETBALL', 'CARROT', 'GOLDFISH', 'PUMPKIN'], ['POLE', 'ROD', 'STAFF', 'STICK'], ['CART', 'CLUB', 'HOLE', 'TEE'], ['CIRCLE', 'HORSESHOE', 'PITCHFORK', 'TRIANGLE']]","['THINGS THAT ARE ORANGE', 'LONG, SKINNY OBJECTS', 'SEEN ON A GOLF COURSE', 'SHAPES OF CAPITAL GREEK LETTERS']"
2024-01-09,"ACID, POLLEN, RAG, PEPPER, MOP, SMOKE, SPONGE, SALT, BROOM, TRACY, MONK, SHAFT, HEAT, DUST, MAGNUM, FAT","[['BROOM', 'MOP', 'RAG', 'SPONGE'], ['SALT', 'FAT', 'ACID', 'HEAT'], ['DUST', 'PEPPER', 'POLLEN', 'SMOKE'], ['MAGNUM', 'MONK', 'SHAFT', 'TRACY']]","['CLEANING SUPPLIES', 'ELEMENTS OF COOKING,  PER SAMIN NOSRAT', 'THINGS THAT MAKE YOU SNEEZE', 'TITULAR FICTIONAL DETECTIVES']"
2024-01-10,"CHIPS, SHRED, CRUMBLE, SLICE, FLUE, DICE, MELT, SPELL, CARDS, CURSE, LOG, HEX, CHARM, SLOTS, GRATE, POKER","[['CHARM', 'CURSE', 'HEX', 'SPELL'], ['FLUE', 'GRATE', 'LOG', 'POKER'], ['CARDS', 'CHIPS', 'DICE', 'SLOTS'], ['CRUMBLE', 'MELT', 'SHRED', 'SLICE']]","['BIT OF MAGIC', 'FOUND AROUND A FIREPLACE', 'THINGS SEEN AT A CASINO', 'WAYS TO PREPARE CHEESE']"
2024-01-11,"PLASMA, GREAT, ELEVATOR, PERFECT, LEGEND, LIQUID, SALES, GAS, FEVER, SOLID, PHISH, PHAT, ICON, PHILLY, HERO, PHEW","[['GAS', 'LIQUID', 'PLASMA', 'SOLID'], ['GREAT', 'HERO', 'ICON', 'LEGEND'], ['PHAT', 'PHEW', 'PHILLY', 'PHISH'], ['ELEVATOR', 'FEVER', 'PERFECT', 'SALES']]","['STATES OF MATTER', 'ALL-TIMER', '“PH” WORDS THAT ALSO WORK WITH “F”', '___ PITCH']"
2024-01-12,"DASH, POINT, CHAPTER, SUBJECT, PERIOD, ISSUE, ROWS, TANK, CHORAL, READ, MATTER, STAGE, PHASE, WHEEL, BLEW, SHOCK","[['ISSUE', 'MATTER', 'POINT', 'SUBJECT'], ['CHAPTER', 'PERIOD', 'PHASE', 'STAGE'], ['DASH', 'SHOCK', 'TANK', 'WHEEL'], ['BLEW', 'CHORAL', 'READ', 'ROWS']]","['TOPIC OF DISCUSSION', 'SECTION OF ONE’S LIFE', 'PARTS OF A CAR, INFORMALLY', 'COLOR HOMOPHONES']"
2024-01-13,"HOLD, LEAD, STALL, PUNT, SAFETY, INVITE, END, TICKET, BADGE, TABLE, PASS, CHAIR, TACKLE, DIRECT, RUN, CENTER","[['BADGE', 'INVITE', 'PASS', 'TICKET'], ['CHAIR', 'DIRECT', 'LEAD', 'RUN'], ['CENTER', 'END', 'SAFETY', 'TACKLE'], ['HOLD', 'PUNT', 'STALL', 'TABLE']]","['CREDENTIALS FOR ENTRY', 'PRESIDE OVER', 'AMERICAN FOOTBALL POSITIONS', 'POSTPONE']"
