date,question,answers,groups
2024-03-23,"PHOTO, TRACK, LEARN, CHASE, STAMP, TAIL, CREDIT, PRAISE, GLORY, REALIZE, PROPS, NAME, FIND, SHADOW, DISCOVER, VISA","[['CREDIT', 'GLORY', 'PRAISE', 'PROPS'], ['DISCOVER', 'FIND', 'LEARN', 'REALIZE'], ['CHASE', 'TAIL', 'TRACK', 'SHADOW'], ['NAME', 'PHOTO', 'STAMP', 'VISA']]","['KUDOS', 'BECOME AWARE OF', 'PURSUE', 'SEEN IN A PASSPORT']"
2024-03-24,"CUT, DITCH, COLOR, BEIGE, ROMP, BLOWOUT, HAMSTER, ROUT, SWEEP, CHEESE, TAN, KHAKI, MISS, SKIP, PRAYER, CAMEL","[['BEIGE', 'CAMEL', 'KHAKI', 'TAN'], ['CUT', 'DITCH', 'MISS', 'SKIP'], ['BLOWOUT', 'ROMP', 'ROUT', 'SWEEP'], ['CHEESE', 'COLOR', 'HAMSTER', 'PRAYER']]","['YELLOW-BROWN SHADES', 'FAIL TO ATTEND', 'DECISIVE VICTORY', '___ WHEEL']"
2024-03-25,"MOVE, FASTER, COMMUTE, PACER, MEDICINE, PACE, SPUR, HURRY, GO, VISION, ROCKET, PROMPTER, SPEED, CLIP, RATE, CLIPPER","[['CLIP', 'PACE', 'RATE', 'SPEED'], ['FASTER', 'GO', 'HURRY', 'MOVE'], ['CLIPPER', 'PACER', 'ROCKET', 'SPUR'], ['COMMUTE', 'MEDICINE', 'PROMPTER', 'VISION']]","['HOW FAST SOMETHING IS GOING', '""STEP ON IT!""', 'N.B.A. TEAM PLAYER', 'TELE___']"
2024-03-26,"LIGHT, HARP, BASSOON, SPROUT, REAR, CORONA, RADIATION, FLARE, FOSTER, BASS, SHOOT, NURSE, BLOOM, RECORDER, RAISE, BUD","[['BASS', 'BASSOON', 'HARP', 'RECORDER'], ['BLOOM', 'BUD', 'SHOOT', 'SPROUT'], ['FOSTER', 'NURSE', 'RAISE', 'REAR'], ['CORONA', 'FLARE', 'LIGHT', 'RADIATION']]","['MUSICAL INSTRUMENTS', 'PLANT GROWTHS', 'BRING UP', 'SOLAR EMANATIONS']"
2024-03-27,"AMEND, ROULETTE, POKER, WAR, REVISE, POTATO, COMPUTER, TIFF, LOTTERY, BLUE, ROW, SCRAP, BINGO, FIX, FIGHT, CORRECT","[['AMEND', 'CORRECT', 'FIX', 'REVISE'], ['FIGHT', 'ROW', 'SCRAP', 'TIFF'], ['BINGO', 'LOTTERY', 'ROULETTE', 'WAR'], ['BLUE', 'COMPUTER', 'POKER', 'POTATO']]","['UPDATE FOR ACCURACY', 'QUARREL', 'GAMES OF CHANCE', '___ CHIP']"
2024-03-28,"ACE, RIGHT, FLIER, FIN, WENT, CASINO, ATM, BLUE, LEFT, GRAY, DEPARTED, AVIATOR, SPATULA, SPLIT, PILOT, SCHEDULE","[['DEPARTED', 'LEFT', 'SPLIT', 'WENT'], ['ACE', 'AVIATOR', 'FLIER', 'PILOT'], ['BLUE', 'FIN', 'GRAY', 'RIGHT'], ['ATM', 'CASINO', 'SCHEDULE', 'SPATULA']]","['EXITED', 'ONE FLYING AN AIRPLANE', 'KINDS OF WHALES', 'THINGS WITH SLOTS']"
2024-03-29,"BABY, LIVERY, LADY, SKY, REALLY, DAISY, VERY, HAPPY, PRETTY, SHINY, ARMY, GOOFY, NAVY, COLONY, TIFFANY, MIGHTY","[['MIGHTY', 'PRETTY', 'REALLY', 'VERY'], ['DAISY', 'GOOFY', 'HAPPY', 'LADY'], ['BABY', 'NAVY', 'SKY', 'TIFFANY'], ['ARMY', 'COLONY', 'LIVERY', 'SHINY']]","['ESPECIALLY', 'DISNEY CHARACTERS', 'KINDS OF BLUE', 'BODY PARTS PLUS ""Y""']"
2024-03-30,"GASPS, PANTS, SALTS, PUFFS, SPOTS, HUFFS, SMOKES, CURES, PICKLES, RAINDROPS, BINDS, MITTENS, JAMS, KETTLES, CANS, WHISKERS","[['GASPS', 'HUFFS', 'PANTS', 'PUFFS'], ['CANS', 'CURES', 'SALTS', 'SMOKES'], ['BINDS', 'JAMS', 'PICKLES', 'SPOTS'], ['KETTLES', 'MITTENS', 'RAINDROPS', 'WHISKERS']]","['BREATHES HEAVILY', 'PRESERVES, AS MEAT', 'PREDICAMENTS', 'THINGS IN “MY FAVORITE THINGS”']"
2024-03-31,"SPILL, STILL, TEDDY, WASP, SLIP, HOURGLASS, SPRING, MINERAL, TAP, CORSET, BOO-BOO, FALL, TRIP, HONEY, BROWN, DIABOLO","[['FALL', 'SLIP', 'SPILL', 'TRIP'], ['MINERAL', 'SPRING', 'STILL', 'TAP'], ['CORSET', 'DIABOLO', 'HOURGLASS', 'WASP'], ['BOO-BOO', 'BROWN', 'HONEY', 'TEDDY']]","['TAKE A TUMBLE', 'KINDS OF WATER', 'THINGS THAT ARE CINCHED IN THE MIDDLE', '___ BEAR']"
2024-04-01,"🥬, 🧠, 🐑, 🥓, 🧀, 👽, 😱, 🫖, 🌧️, 🍞, 🧛, ✈️, 🚂, 👁️, 🐝, 🪚","[['🥓', '🍞', '🥬', '🧀'], ['🧠', '✈️', '🌧️', '🚂'], ['👽', '🧛', '🪚', '😱'], ['🐝', '🐑', '👁️', '🫖']]","['FOOD SLANG FOR MONEY', 'WORDS THAT RHYME', 'HORROR MOVIES', 'LETTER HOMOPHONES']"
2024-04-02,"ADDER, POKE, TUBE, MAMBA, STICK, BALL, PUMPKIN, PROD, ELBOW, SLIPPER, WHEEL, PRINCE, BOWTIE, JAB, MOCCASIN, BOA","[['JAB', 'POKE', 'PROD', 'STICK'], ['ADDER', 'BOA', 'MAMBA', 'MOCCASIN'], ['BALL', 'PRINCE', 'PUMPKIN', 'SLIPPER'], ['BOWTIE', 'ELBOW', 'TUBE', 'WHEEL']]","['THRUST', 'KINDS OF SNAKES', 'SEEN IN “CINDERELLA”', 'PASTA SHAPES']"
2024-04-03,"NORMAL, GAUGE, YARDSTICK, MARY, OILY, STANDARD, WASH, CALL, KENT, CHECK, COMBINATION, FOLD, BET, MASS, BENCHMARK, DRY","[['BENCHMARK', 'GAUGE', 'STANDARD', 'YARDSTICK'], ['BET', 'CALL', 'CHECK', 'FOLD'], ['COMBINATION', 'DRY', 'NORMAL', 'OILY'], ['KENT', 'MARY', 'MASS', 'WASH']]","['BENCHMARK', 'POKER ACTIONS', 'SKIN TYPES', 'STARTS OF U.S. STATES']"
2024-04-04,"BUBBLE, AXE, RING, KICK, THRILL, SHRINK, POACH, DART, RUSH, BOIL, SCRAMBLE, BUZZ, FRY, GIFT, HORSESHOE, BODY","[['BOIL', 'FRY', 'POACH', 'SCRAMBLE'], ['BUZZ', 'KICK', 'RUSH', 'THRILL'], ['AXE', 'DART', 'HORSESHOE', 'RING'], ['BODY', 'BUBBLE', 'GIFT', 'SHRINK']]","['WAYS TO PREPARE EGGS', 'EXHILARATION', 'THROWN IN TARGET GAMES', '___ WRAP']"
2024-04-05,"FULL, LEADERSHIP, HARBOR, COUCH, TINDER, HOLD, IRONIC, GOLDILOCKS, DRY, BALANCED, MAINTAIN, TABLE, SWEET, BEAR, CHAIR, BED","[['BED', 'CHAIR', 'COUCH', 'TABLE'], ['BEAR', 'HARBOR', 'HOLD', 'MAINTAIN'], ['BALANCED', 'DRY', 'FULL', 'SWEET'], ['GOLDILOCKS', 'IRONIC', 'LEADERSHIP', 'TINDER']]","['PIECES OF FURNITURE', 'CARRY, AS A FEELING', 'WINE TASTING DESCRIPTORS', 'STARTING WITH METALS']"
2024-04-06,"RESOLVE, ARRAY, SUNGLASSES, RADISH, SET, FLY, HAT, SERIES, TEE, POWER, BATTERY, WILL, DESIRE, DRIVE, SHOE, SHORTS","[['DESIRE', 'DRIVE', 'RESOLVE', 'WILL'], ['HAT', 'SHORTS', 'SUNGLASSES', 'TEE'], ['ARRAY', 'BATTERY', 'SET', 'SERIES'], ['FLY', 'POWER', 'RADISH', 'SHOE']]","['INTRINSIC MOTIVATORS', 'SUMMER GEAR', 'COLLECTION', 'HORSE___']"
2024-04-07,"MESS, STABLE, FIRM, DUMP, GIFT, CHARLEY, SOLID, PIGPEN, STY, POPCORN, SOUND, DARK, PEANUTS, CRAZY, CARAMEL, PRIZE","[['DUMP', 'MESS', 'PIGPEN', 'STY'], ['FIRM', 'SOLID', 'SOUND', 'STABLE'], ['CARAMEL', 'PEANUTS', 'POPCORN', 'PRIZE'], ['CHARLEY', 'CRAZY', 'DARK', 'GIFT']]","['DISORDERLY PLACE', 'STURDY', 'FOUND IN CRACKER JACKS', '___ HORSE']"
2024-04-08,"SQUAT, LOVE, SPAT, FLASH, TANGLE, ZIP, TIFF, CANE, TOP HAT, CLASH, WINK, JACK, HEARTBEAT, SCRAP, MONOCLE, JIFF","[['FLASH', 'HEARTBEAT', 'JIFF', 'WINK'], ['CLASH', 'SCRAP', 'TANGLE', 'TIFF'], ['JACK', 'LOVE', 'SQUAT', 'ZIP'], ['CANE', 'MONOCLE', 'SPAT', 'TOP HAT']]","['BRIEF MOMENT', 'DISPUTE', 'SLANG FOR ZERO', 'ACCESSORIES FOR MR. PEANUT']"
2024-04-09,"ARMS, SHIELD, IRON, STEEL, CREST, RANGE, COAT, REACH, KETTLE, BRUSH, EXTENT, OIL, COMB, EAR, DRYER, SCOPE","[['EXTENT', 'RANGE', 'REACH', 'SCOPE'], ['BRUSH', 'COMB', 'DRYER', 'IRON'], ['ARMS', 'COAT', 'CREST', 'SHIELD'], ['EAR', 'KETTLE', 'OIL', 'STEEL']]","['BREADTH', 'HAIR TOOLS', 'HERALDRY TERMS', 'WORDS BEFORE “DRUM”']"
2024-04-10,"CHIEF, CHAIR, COCO, GREEN, CHEST, DIRECTOR, FIELD, HAZEL, DOGS, LAWN, UNCHAINED, BROWN, HEAD, GROUNDS, PEA, FICTION","[['CHAIR', 'CHIEF', 'DIRECTOR', 'HEAD'], ['FIELD', 'GREEN', 'GROUNDS', 'LAWN'], ['CHEST', 'COCO', 'HAZEL', 'PEA'], ['BROWN', 'DOGS', 'FICTION', 'UNCHAINED']]","['PERSON IN CHARGE', 'GRASSY AREA', 'WORDS BEFORE “NUT”', 'SECOND WORDS IN TARANTINO MOVIES']"
2024-04-11,"MERMAID, MAIN, COMPASS, PIXIE, LINE, WATCH, BOWL, COLONEL, SCALE, PIPE, CLOWN, KING, CREW, BUZZ, RULER, CHANNEL","[['BOWL', 'BUZZ', 'CREW', 'PIXIE'], ['COMPASS', 'RULER', 'SCALE', 'WATCH'], ['CHANNEL', 'LINE', 'MAIN', 'PIPE'], ['CLOWN', 'COLONEL', 'KING', 'MERMAID']]","['HAIRCUTS, WITH “CUT”', 'MEASURING INSTRUMENTS', 'WATER AND GAS CONDUITS', 'FAST FOOD MASCOTS']"
2024-04-12,"HYPER, JACK, SUPER, MUSHROOM, TIDY, DOMINO, ULTRA, SWELL, NEAT, UBER, BALLOON, TRIM, MARBLE, CLEAN, STICK, SNOWBALL","[['CLEAN', 'NEAT', 'TIDY', 'TRIM'], ['HYPER', 'SUPER', 'UBER', 'ULTRA'], ['BALLOON', 'MUSHROOM', 'SNOWBALL', 'SWELL'], ['DOMINO', 'JACK', 'MARBLE', 'STICK']]","['ORDERLY', 'AUGMENTATIVE PREFIXES', 'BECOME LARGER', 'ITEMS IN CLASSIC KIDS’ GAMES']"
2024-04-13,"TENT, WARDROBE, SMOKER, MAKEUP, LION, TRAPEZE, RING, WITCH, LOVER, CLOWN, PROPS, WIZARD, JOKER, HAIR, SINNER, SCARECROW","[['CLOWN', 'RING', 'TENT', 'TRAPEZE'], ['LION', 'SCARECROW', 'WITCH', 'WIZARD'], ['HAIR', 'MAKEUP', 'PROPS', 'WARDROBE'], ['JOKER', 'LOVER', 'SINNER', 'SMOKER']]","['SEEN AT THE CIRCUS', '“THE WIZARD OF OZ” FIGURES', 'FILM DEPARTMENTS', '“I’M A ___” (LYRICS IN “THE JOKER”)']"
2024-04-14,"FRIAR, WRENCH, PRACTICE, DRILL, AMERICAN, MONKEY, FRONTIER, WEDDING, EXERCISE, ROUTINE, UNITED, RIP, TEAR, SPIRIT, SUNDRY, YANK","[['RIP', 'TEAR', 'WRENCH', 'YANK'], ['DRILL', 'EXERCISE', 'PRACTICE', 'ROUTINE'], ['AMERICAN', 'FRONTIER', 'SPIRIT', 'UNITED'], ['FRIAR', 'MONKEY', 'SUNDRY', 'WEDDING']]","['PULL USING FORCE', 'BIT OF REPETITIVE TRAINING', 'U.S.-BASED AIRLINES', 'BEGINNING WITH DAY ABBREVIATIONS']"
2024-04-15,"AD-LIB, COO, SURFACE, COSMETIC, NURSE, SIDE, MAKE UP, BUTTERFLY, SHALLOW, DOMINO, EXTERNAL, CRAWL, FREESTYLE, IMPROV, BABBLE, PLACEBO","[['AD-LIB', 'FREESTYLE', 'IMPROV', 'MAKE UP'], ['BABBLE', 'COO', 'CRAWL', 'NURSE'], ['COSMETIC', 'EXTERNAL', 'SHALLOW', 'SURFACE'], ['BUTTERFLY', 'DOMINO', 'PLACEBO', 'SIDE']]","['INVENT AS YOU GO', 'THINGS BABIES DO', 'SUPERFICIAL', '___ EFFECT']"
2024-04-16,"FLAT, SURPRISE, FLUSH, SHOCK, STAGE, ORCHESTRA, STORY, EVEN, BOX, ARTICLE, ROCK, BALCONY, REPORT, FLOOR, FEATURE, LEVEL","[['FLOOR', 'ROCK', 'SHOCK', 'SURPRISE'], ['ARTICLE', 'FEATURE', 'REPORT', 'STORY'], ['EVEN', 'FLAT', 'FLUSH', 'LEVEL'], ['BALCONY', 'BOX', 'ORCHESTRA', 'STAGE']]","['FLABBERGAST', 'BIT OF JOURNALISM', 'ON THE SAME PLANE', 'THEATER SECTIONS']"
2024-04-17,"INFORMATION, REGARD, DIRT, MIND, PERCENTAGE, FOLLOW, SHARE, COLUMN, SECRETS, POLE, STAKE, INTELLIGENCE, OBSERVE, PILLAR, POST, INTEREST","[['COLUMN', 'PILLAR', 'POLE', 'POST'], ['FOLLOW', 'MIND', 'OBSERVE', 'REGARD'], ['INTEREST', 'PERCENTAGE', 'SHARE', 'STAKE'], ['DIRT', 'INFORMATION', 'INTELLIGENCE', 'SECRETS']]","['UPRIGHT SUPPORT', 'HEED, AS RULES', 'ALLOTMENT', 'GATHERED BY SPIES']"
2024-04-18,"GUTTER, AIM, FLEECE, PLAN, GIRLS, RULE, GAL, CAL, MEAN, IN, MANHOLE, PARACHUTE, GRATE, CURB, OZ, INTEND","[['CURB', 'GRATE', 'GUTTER', 'MANHOLE'], ['AIM', 'INTEND', 'MEAN', 'PLAN'], ['CAL', 'GAL', 'IN', 'OZ'], ['FLEECE', 'GIRLS', 'PARACHUTE', 'RULE']]","['SIDEWALK SIGHTS', 'HAVE IN MIND', 'UNIT ABBREVIATIONS', 'GOLDEN ___']"
2024-04-19,"CARAT, LIST, TEXT, CUT, GLUE, WRITING, COPY, WORDS, ADHERE, STICK, CLARITY, ROD, OK, PASTE, PLUS, COLOR","[['ADHERE', 'GLUE', 'PASTE', 'STICK'], ['COPY', 'TEXT', 'WORDS', 'WRITING'], ['CARAT', 'CLARITY', 'COLOR', 'CUT'], ['LIST', 'OK', 'PLUS', 'ROD']]","['ATTACH WITH ADHESIVE', 'PUBLISHED LINES', 'DIAMOND QUALITIES', 'A-___']"
2024-04-20,"GOATEE, PITCHFORK, HURDLE, SHEEPSHANK, BEND, BATON, CROCK, HITCH, POLE, HORNS, HOGWASH, HAMMER, TAIL, BOWLINE, HORSEFEATHERS, BUNK","[['BUNK', 'CROCK', 'HOGWASH', 'HORSEFEATHERS'], ['BATON', 'HAMMER', 'HURDLE', 'POLE'], ['GOATEE', 'HORNS', 'PITCHFORK', 'TAIL'], ['BEND', 'BOWLINE', 'HITCH', 'SHEEPSHANK']]","['BALDERDASH', 'TRACK AND FIELD EQUIPMENT', 'PARTS OF A DEVIL COSTUME', 'TYPES OF KNOTS']"
2024-04-21,"SYMBOL, WAX, MARK, CAR, CONDUCTOR, IDEAL, SIMMER, MODEL, DRUM, WIG, EXAMPLE, SCIMITAR, STATION, TRACK, CYMBAL, SYMPHONY","[['EXAMPLE', 'IDEAL', 'MODEL', 'SYMBOL'], ['CAR', 'CONDUCTOR', 'STATION', 'TRACK'], ['CYMBAL', 'SCIMITAR', 'SIMMER', 'SYMPHONY'], ['DRUM', 'MARK', 'WAX', 'WIG']]","['EMBODIMENT', 'RELATED TO TRAINS', 'STARTING WITH THE SAME SOUND', 'EAR___']"
2024-04-22,"CHUM, BUD, SHADOW, FUND, MATE, MUSTY, POOL, KITTY, DANK, SCRUFF, FUZZ, WHISKERS, POT, PAL, COLD, DARK","[['BUD', 'CHUM', 'MATE', 'PAL'], ['COLD', 'DANK', 'DARK', 'MUSTY'], ['FUZZ', 'SCRUFF', 'SHADOW', 'WHISKERS'], ['FUND', 'KITTY', 'POOL', 'POT']]","['SLANG FOR FRIEND', 'ADJECTIVES FOR A BASEMENT', 'STUBBLE', 'COLLECTION OF MONEY']"
2024-04-23,"SPLASH, PHILIPPINE, SOIL, BLACK, TOSS, LAND, GROUND, PHILADELPHIA, BOUNCE, BALTIC, EARTH, RED, BOOT, SULLY, BIG, EJECT","[['BOOT', 'BOUNCE', 'EJECT', 'TOSS'], ['EARTH', 'GROUND', 'LAND', 'SOIL'], ['BALTIC', 'BLACK', 'PHILIPPINE', 'RED'], ['BIG', 'PHILADELPHIA', 'SPLASH', 'SULLY']]","['THROW OUT', 'TERRA FIRMA', 'SEAS', 'TOM HANKS MOVIES']"
2024-04-24,"MINI, LIME, CAPITOL, POODLE, PENCIL, MICRO, CILANTRO, SALSA, FAITH, MOLE, KILO, WRAP, ONION, FOOT, PICO, MEGA","[['CILANTRO', 'LIME', 'ONION', 'SALSA'], ['KILO', 'MEGA', 'MICRO', 'PICO'], ['MINI', 'PENCIL', 'POODLE', 'WRAP'], ['CAPITOL', 'FAITH', 'FOOT', 'MOLE']]","['TACO TOPPINGS', 'METRIC PREFIXES', 'KINDS OF SKIRTS', 'WORDS WITH “HILL”']"
2024-04-25,"LOVE, FORMULA, MICROSCOPE, HEART, SORT, SIGN, BODY, CENTER, GOGGLES, SHEET, NUCLEUS, BEAKER, HUB, CELL, ROMANCE, DROPPER","[['BEAKER', 'DROPPER', 'GOGGLES', 'MICROSCOPE'], ['CENTER', 'HEART', 'HUB', 'NUCLEUS'], ['CELL', 'FORMULA', 'SHEET', 'SORT'], ['BODY', 'LOVE', 'ROMANCE', 'SIGN']]","['LAB EQUIPMENT', 'NEXUS', 'SPREADSHEET TERMS', '___ LANGUAGE']"
2024-04-26,"SOUR, SINE, TASTE, TOUCH, SEN, GRACE, BASK, IMPACT, AFFECT, ELEGANCE, SUN, MOVE, BAKE, SIGHT, TAN, STYLE","[['ELEGANCE', 'GRACE', 'STYLE', 'TASTE'], ['BAKE', 'BASK', 'SUN', 'TAN'], ['AFFECT', 'IMPACT', 'MOVE', 'TOUCH'], ['SEN', 'SIGHT', 'SINE', 'SOUR']]","['REFINED SENSIBILITY', 'CATCH SOME RAYS', 'EMOTIONALLY SWAY ', 'NUMBERS WITH FIRST LETTERS REPLACED BY “S”']"
2024-04-27,"OUTAGE, SWALLOW, HAIRY, KNEEL, ACCEPT, SURGE, BUY, BRIEF, WANE, DIGEST, BELIEVE, SHORT, OUTLINE, SPIKE, ABSTRACT, CURT","[['ACCEPT', 'BELIEVE', 'BUY', 'SWALLOW'], ['OUTAGE', 'SHORT', 'SPIKE', 'SURGE'], ['ABSTRACT', 'BRIEF', 'DIGEST', 'OUTLINE'], ['CURT', 'HAIRY', 'KNEEL', 'WANE']]","['TRUST AS REAL', 'POWER ISSUES', 'SUMMARY', 'NAME HOMOPHONES']"
2024-04-28,"RAM, STATIC, FUZZ, PROUD, DEEP, KNOCK, EXTREME, VIRGIN, SNOW, NOISE, FIERCE, BUTT, BLOODY, BUMP, HAIL, INTENSE","[['DEEP', 'EXTREME', 'FIERCE', 'INTENSE'], ['BUMP', 'BUTT', 'KNOCK', 'RAM'], ['FUZZ', 'NOISE', 'SNOW', 'STATIC'], ['BLOODY', 'HAIL', 'PROUD', 'VIRGIN']]","['PASSIONATE, AS A FEELING', 'BANG INTO', 'ANALOG TV INTERFERENCE', '___ MARY']"
2024-04-29,"SPELLING, BRIDGE, CARTER, SALOON, GORE, TUTU, BOUNTY, BUSY, KING, CRUNCH, DUEL, QUEEN, SQUAT, HONEY, COWBOY, DIP","[['BRIDGE', 'CRUNCH', 'DIP', 'SQUAT'], ['BOUNTY', 'COWBOY', 'DUEL', 'SALOON'], ['CARTER', 'GORE', 'KING', 'TUTU'], ['BUSY', 'HONEY', 'QUEEN', 'SPELLING']]","['EXERCISES', 'FEATURED IN WESTERNS', 'LEADERS WHO RECEIVED THE NOBEL PEACE PRIZE', '___ BEE']"
2024-04-30,"CATTLE, EXAMINE, INVOICE, MARINARA, GRILL, RANCH, MERCHANDISE, BROTH, BARBECUE, PROBE, BILL, STATEMENT, AIOLI, QUESTION, RECEIPT, ANCESTRY","[['AIOLI', 'BARBECUE', 'MARINARA', 'RANCH'], ['EXAMINE', 'GRILL', 'PROBE', 'QUESTION'], ['BILL', 'INVOICE', 'RECEIPT', 'STATEMENT'], ['ANCESTRY', 'BROTH', 'CATTLE', 'MERCHANDISE']]","['DIPPING SAUCES', 'INTERROGATE', 'TRANSACTION RECORD', 'WHAT “STOCK” MIGHT MEAN']"
2024-05-01,"SUPREME, POINT, SOLID, BUTTON, PLANE, WINDOW, DOOR, FLY, LINE, KINK, FILE, RIVET, ANIMAL, HISTORY, POCKET, VIEW","[['BUTTON', 'FLY', 'POCKET', 'RIVET'], ['LINE', 'PLANE', 'POINT', 'SOLID'], ['FILE', 'HISTORY', 'VIEW', 'WINDOW'], ['ANIMAL', 'DOOR', 'KINK', 'SUPREME']]","['FEATURES ON A PAIR OF JEANS', 'OBJECTS IN 0-, 1-, 2- AND 3-DIMENSIONAL SPACE', 'WEB BROWSER MENUS', 'MEMBER OF A ’60S BAND']"
2024-05-02,"CRACKERJACK, EXPERT, ROCKETRY, GLADIATOR, HER, JOKER, SIGNS, TIRE, POPCORN, ACE, WRENCH, JACK, RAPTURE, CHOCK, HOTSHOT, SOULMATE","[['ACE', 'CRACKERJACK', 'EXPERT', 'HOTSHOT'], ['CHOCK', 'JACK', 'TIRE', 'WRENCH'], ['GLADIATOR', 'HER', 'JOKER', 'SIGNS'], ['POPCORN', 'RAPTURE', 'ROCKETRY', 'SOULMATE']]","['HIGHLY SKILLED', 'USED TO FIX A FLAT', 'JOAQUIN PHOENIX MOVIES', 'WORDS STARTING WITH MUSIC GENRES']"
2024-05-03,"SAMPLE, BAR, DISCO, FATHOM, LOSE, YARD, LEAGUE, SHED, GARAGE, DITCH, FOOT, DROP, CLUB, CLEARANCE, LOUNGE, BAKE","[['BAR', 'CLUB', 'DISCO', 'LOUNGE'], ['DITCH', 'DROP', 'LOSE', 'SHED'], ['FATHOM', 'FOOT', 'LEAGUE', 'YARD'], ['BAKE', 'CLEARANCE', 'GARAGE', 'SAMPLE']]","['NIGHTSPOTS', 'CAST OFF', 'UNITS OF LENGTH', '___ SALE']"
2024-05-04,"JEWEL, RELISH, LITERALLY, UM, OM, CYLINDER, WELL, SPRING, HURTS, TUMBLER, CARROT, LIKE, FANCY, PIN, LOVE, SAVOR","[['FANCY', 'LOVE', 'RELISH', 'SAVOR'], ['LIKE', 'LITERALLY', 'UM', 'WELL'], ['CYLINDER', 'PIN', 'SPRING', 'TUMBLER'], ['CARROT', 'HURTS', 'JEWEL', 'OM']]","['ENJOY', 'FILLER WORDS', 'COMPONENTS OF A LOCK', 'HOMOPHONES OF UNITS OF MEASURE']"
2024-05-05,"FRUIT, WERE, VAMP, EGG, FRANK, REWARD, BENEFIT, PLAIN, POPPY, EVERYTHING, ACT, RETURN, MUM, DIRECT, PRODUCE, WRITE","[['BENEFIT', 'FRUIT', 'RETURN', 'REWARD'], ['EGG', 'EVERYTHING', 'PLAIN', 'POPPY'], ['ACT', 'DIRECT', 'PRODUCE', 'WRITE'], ['FRANK', 'MUM', 'VAMP', 'WERE']]","['SOMETHING GAINED FROM HARD WORK', 'KINDS OF BAGELS', 'CONTRIBUTE TO A MOVIE', 'STARTS OF MONSTERS']"
2024-05-06,"MAGICIAN, COUPLE, JOIN, PAIN, HANDFUL, SOME, BOTHER, SEVERAL, TOWER, MANY, LINK, FEW, LOVERS, FOOL, PEST, TIE","[['COUPLE', 'JOIN', 'LINK', 'TIE'], ['BOTHER', 'HANDFUL', 'PAIN', 'PEST'], ['FEW', 'MANY', 'SEVERAL', 'SOME'], ['FOOL', 'LOVERS', 'MAGICIAN', 'TOWER']]","['CONNECT', 'NUISANCE', 'QUANTITY WORDS', 'TAROT CARDS, WITH “THE”']"
2024-05-07,"CHOPS, ROLL, TRAP, CLAP, YAP, BUN, SNAP, WRAP, DRINKS, TAP, GOLF, BOB, APPLAUSE, KISSER, FUNDING, HERO","[['BUN', 'HERO', 'ROLL', 'WRAP'], ['CHOPS', 'KISSER', 'TRAP', 'YAP'], ['BOB', 'CLAP', 'SNAP', 'TAP'], ['APPLAUSE', 'DRINKS', 'FUNDING', 'GOLF']]","['DELI BREAD OPTIONS', 'SLANG FOR MOUTH', 'KEEP RHYTHM WITH MUSIC', 'ROUND OF ___']"
2024-05-08,"DROP, BIRD, BEST, PICK, SPRINKLE, SPLASH, BRICK, RUBY, CREAM, BUBBLE, ROSE, CHERRY, SPOT, MUD, TOP, SPONGE","[['BRICK', 'CHERRY', 'ROSE', 'RUBY'], ['DROP', 'SPLASH', 'SPOT', 'SPRINKLE'], ['BEST', 'CREAM', 'PICK', 'TOP'], ['BIRD', 'BUBBLE', 'MUD', 'SPONGE']]","['SHADES OF RED', 'LITTLE BIT OF A BEVERAGE', 'CHOICEST', '___ BATH']"
2024-05-09,"LID, PERIOD, LIMIT, STRETCH, TIME, FUR, VENOM, SPELL, EGG, CURB, CONTAIN, BILL, CHECK, CORK, TAB, CAP","[['CAP', 'CORK', 'LID', 'TAB'], ['PERIOD', 'SPELL', 'STRETCH', 'TIME'], ['CHECK', 'CONTAIN', 'CURB', 'LIMIT'], ['BILL', 'EGG', 'FUR', 'VENOM']]","['CONTAINER CLOSURES', 'DURATION', 'REGULATE', 'TRADEMARKS OF A PLATYPUS']"
2024-05-10,"BRASS, HARNESS, LEAD, TOP, COLLAR, PLANT, GLOBE, NERVE, HALTER, GALL, CHEEK, NICKS, CAROUSEL, FERRY, RECORD, MERCURY","[['BRASS', 'CHEEK', 'GALL', 'NERVE'], ['COLLAR', 'HALTER', 'HARNESS', 'LEAD'], ['CAROUSEL', 'GLOBE', 'RECORD', 'TOP'], ['FERRY', 'MERCURY', 'NICKS', 'PLANT']]","['CHUTZPAH', 'ACCESSORIES FOR DOG WALKING', 'THINGS THAT SPIN', 'LEAD SINGERS OF ’70S ROCK BANDS']"
2024-05-11,"PRINCIPAL, SANDWICH, CRACKED, MAD, LAMPOON, HEADLINER, MED, STAR, SILVER, LEAD, MUSIC, GARLIC, SUN, CROSS, SODA, ONION","[['HEADLINER', 'LEAD', 'PRINCIPAL', 'STAR'], ['CROSS', 'GARLIC', 'SILVER', 'SUN'], ['CRACKED', 'LAMPOON', 'MAD', 'ONION'], ['MED', 'MUSIC', 'SANDWICH', 'SODA']]","['ONE WITH TOP BILLING', 'VAMPIRE VULNERABILITIES', 'SATIRICAL PUBLICATIONS, FAMILIARLY', 'CLUB ___']"
2024-05-12,"ROUND, RIB, NEEDLE, TEASE, MIA, MAMA, SLING, LIBRE, MULE, LOIN, FLANK, PIN, RAM, OMG, KID, CHUCK","[['KID', 'NEEDLE', 'RIB', 'TEASE'], ['CHUCK', 'FLANK', 'LOIN', 'ROUND'], ['MIA', 'OMG', 'PIN', 'RAM'], ['LIBRE', 'MAMA', 'MULE', 'SLING']]","['PLAYFULLY POKE FUN AT', 'CUTS OF BEEF', 'ACRONYMS', 'COCKTAILS MINUS PLACE NAMES']"
2024-05-13,"HOP, BRAND, LINE, DUCK, HIDE, COLLECTION, DODGE, KATZ, LABEL, MARTIAN, PIG, BUNNY, TAG, GREECE, HARE, MAIM","[['BRAND', 'COLLECTION', 'LABEL', 'LINE'], ['DODGE', 'HIDE', 'HOP', 'TAG'], ['BUNNY', 'DUCK', 'MARTIAN', 'PIG'], ['GREECE', 'HARE', 'KATZ', 'MAIM']]","[""FASHION DESIGNER'S OUTPUT"", 'PLAYGROUND VERBS', 'LOONEY TUNES FIGURES', 'HOMOPHONES OF MUSICALS']"
2024-05-14,"YO, DINE, DRAFT, FEED, PLAN, SUP, FEAST, PICKINGS, SUS, SKETCH, ME, JIM, OUTLINE, FIT, SHADY, ELLA","[['DRAFT', 'OUTLINE', 'PLAN', 'SKETCH'], ['DINE', 'FEAST', 'FEED', 'SUP'], ['ELLA', 'ME', 'SUS', 'YO'], ['FIT', 'JIM', 'PICKINGS', 'SHADY']]","['EARLY ITERATION', 'ENJOY A MEAL', 'SPANISH PRONOUNS', 'SLIM ___']"
2024-05-15,"MEADOW, HODA, MEASURE, DIRECT, BILL, SAVANNA, DOGE, AURA, RESOLUTION, FRANK, ACT, BUCK, PRAIRIE, PLAIN, OPEN, STRAIGHT","[['ACT', 'BILL', 'MEASURE', 'RESOLUTION'], ['MEADOW', 'PLAIN', 'PRAIRIE', 'SAVANNA'], ['DIRECT', 'FRANK', 'OPEN', 'STRAIGHT'], ['AURA', 'BUCK', 'DOGE', 'HODA']]","['BIT OF LEGISLATION', 'GRASSLAND', 'FORTHRIGHT', 'CAR COMPANIES MINUS LETTER']"
2024-05-16,"PICNIC, GLIDE, SNAP, COAST, SAIL, SECURITY, STILL, PIC, SECURE, ICE, CINCH, THROW, SHOT, LOCK, WET, BREEZE","[['PIC', 'SHOT', 'SNAP', 'STILL'], ['CINCH', 'ICE', 'LOCK', 'SECURE'], ['BREEZE', 'COAST', 'GLIDE', 'SAIL'], ['PICNIC', 'SECURITY', 'THROW', 'WET']]","['PHOTO', 'ASSURE, AS A VICTORY', 'MOVE IN AN EFFORTLESS WAY', '___ BLANKET']"
2024-05-17,"PONG, CAN, VILE, FRUIT, CONTACT, BASE, PING, SKULL, TEXT, GARDEN, MESSAGE, DIRTY, BATTER, TABLECLOTH, PITCHER, LOW","[['BASE', 'DIRTY', 'LOW', 'VILE'], ['CONTACT', 'MESSAGE', 'PING', 'TEXT'], ['FRUIT', 'PITCHER', 'SKULL', 'TABLECLOTH'], ['BATTER', 'CAN', 'GARDEN', 'PONG']]","['CORRUPT', 'REACH OUT TO', 'CLASSIC STILL LIFE COMPONENTS', 'BEER ___']"
2024-05-18,"SWITCHBACK, CATEGORIES, TRAMPOLINE, TURTLEDOVE, WEREWOLF, CHARADES, DOGLEG, BULLDOG, MOUSETRAP, HAIRPIN, CLOCK, CATFISH, HORSEFLY, ZAG, MATTRESS, FISHBOWL","[['BULLDOG', 'CATFISH', 'HORSEFLY', 'TURTLEDOVE'], ['DOGLEG', 'HAIRPIN', 'SWITCHBACK', 'ZAG'], ['CATEGORIES', 'CHARADES', 'FISHBOWL', 'WEREWOLF'], ['CLOCK', 'MATTRESS', 'MOUSETRAP', 'TRAMPOLINE']]","['ANIMALS WHOSE NAMES ARE TWO ANIMALS', 'SHARP TURNS', 'CLASSIC PARTY GAMES', 'THINGS WITH SPRING/S']"
2024-05-19,"MINCE, SQUARE, STUFFY, LOADED, CHOP, STRAIGHT, BURY, WEALTHY, LEACHY, CUBE, FLUSH, CURRENT, TRADITIONAL, DICE, RICH, PAIR","[['FLUSH', 'LOADED', 'RICH', 'WEALTHY'], ['CHOP', 'CUBE', 'DICE', 'MINCE'], ['SQUARE', 'STRAIGHT', 'STUFFY', 'TRADITIONAL'], ['BURY', 'CURRENT', 'LEACHY', 'PAIR']]","['AFFLUENT', 'CUT INTO PIECES', 'OLD-FASHIONED', 'FRUIT HOMOPHONES']"
2024-05-20,"MAGIC, TIGHTS, PUPPET, CHARM, WOO, SCOTT, CARPENTER, BAY, CAPE, INSTRUMENT, SPELL, MASK, PAWN, UNDERWEAR, TOOL, HEX","[['CHARM', 'HEX', 'MAGIC', 'SPELL'], ['INSTRUMENT', 'PAWN', 'PUPPET', 'TOOL'], ['CAPE', 'MASK', 'TIGHTS', 'UNDERWEAR'], ['BAY', 'CARPENTER', 'SCOTT', 'WOO']]","['SORCERER’S OUTPUT', 'ONE BEING MANIPULATED', 'CLASSIC SUPERHERO WEAR', 'ACTION MOVIE DIRECTORS']"
2024-05-21,"CUE, DEAL, TOUCH, VALUE, PINCH, MATCH, RACK, MAC, FACE, CHALK, DASH, BALL, BIT, POCKET, STEAL, BUY","[['BIT', 'DASH', 'PINCH', 'TOUCH'], ['BUY', 'DEAL', 'STEAL', 'VALUE'], ['BALL', 'CHALK', 'CUE', 'RACK'], ['FACE', 'MAC', 'MATCH', 'POCKET']]","['SMIDGEN', 'BARGAIN', 'BILLIARDS EQUIPMENT', '___BOOK (THAT’S NOT A BOOK)']"
2024-05-22,"SHELLS, WHEELS, TOES, GOSSIP, PARES, SHOULDERS, BEES, RIDE, SHUCKS, KNEES, CAFFEINE, WHIP, AUTO, INTERCOMS, HEAD, PEELS","[['HEAD', 'KNEES', 'SHOULDERS', 'TOES'], ['AUTO', 'RIDE', 'WHEELS', 'WHIP'], ['PARES', 'PEELS', 'SHELLS', 'SHUCKS'], ['BEES', 'CAFFEINE', 'GOSSIP', 'INTERCOMS']]","['BODY PARTS IN “HEAD, SHOULDERS, KNEES AND TOES”', 'CAR, INFORMALLY', 'REMOVES THE COVERING OF', '“BUZZY” THINGS']"
2024-05-23,"SUPPER, CULTURE, HIJINKS, LEVERAGE, SPORTS, YOGURT, USE, CITY, HEYDAY, DONE, UP, EXPLOIT, MILK, THROUGH, COPY, OVER","[['EXPLOIT', 'LEVERAGE', 'MILK', 'USE'], ['DONE', 'OVER', 'THROUGH', 'UP'], ['CITY', 'COPY', 'CULTURE', 'SPORTS'], ['HEYDAY', 'HIJINKS', 'SUPPER', 'YOGURT']]","['TAKE ADVANTAGE OF', 'FINISHED, AS TIME', 'NEWSPAPER DESKS', 'WORDS BEGINNING WITH GREETINGS']"
2024-05-24,"CHUMP, WINDOW, DUCT, LOOSE, PIPE, SMILE, CORN, CHEESE, EGG, SCHMALTZ, DRAIN, SEA, SAP, CLIMATE, SEWER, KNUCKLES","[['DRAIN', 'DUCT', 'PIPE', 'SEWER'], ['CHEESE', 'CORN', 'SAP', 'SCHMALTZ'], ['EGG', 'KNUCKLES', 'SMILE', 'WINDOW'], ['CHUMP', 'CLIMATE', 'LOOSE', 'SEA']]","['CONDUITS FOR WATER REMOVAL', 'FOOD PRODUCTS ASSOCIATED WITH SENTIMENTALITY', 'THINGS TO CRACK', '___ CHANGE']"
2024-05-25,"INITIAL, USE, CHAMPION, PREMIER, SIGN, THEME, FIRST, SUPPORT, BILLBOARD, HERE, ENDORSE, MAIDEN, BANNER, POSTER, BACK, WEE","[['BANNER', 'BILLBOARD', 'POSTER', 'SIGN'], ['FIRST', 'INITIAL', 'MAIDEN', 'PREMIER'], ['BACK', 'CHAMPION', 'ENDORSE', 'SUPPORT'], ['HERE', 'THEME', 'USE', 'WEE']]","['ADVERTISING FORMAT', 'INAUGURAL', 'ADVOCATE FOR', 'PRONOUN PLUS “E”']"
2024-05-26,"RUFFLE, WISE, TEASE, GEEZ, POT, KETTLE, LAY, SET, FRILL, FRINGE, PUT, PAN, GRIDDLE, PLACE, SEIZE, TRIM","[['GRIDDLE', 'KETTLE', 'PAN', 'POT'], ['FRILL', 'FRINGE', 'RUFFLE', 'TRIM'], ['LAY', 'PLACE', 'PUT', 'SET'], ['GEEZ', 'SEIZE', 'TEASE', 'WISE']]","['FOUND ON A STOVE TOP', 'ORNAMENTAL BORDER', 'DEPOSIT, WITH “DOWN”', 'WORDS THAT SOUNDS LIKE PLURAL LETTERS']"
2024-05-27,"TIRE, HEEL, SHAKE, STEAM, CHOICE, VOTE, VOICE, WHOLE, SPEAK, PUMP, SAY, QUARTER, WAFFLE, DOWN, NATURAL, FLAT","[['CHOICE', 'SAY', 'VOICE', 'VOTE'], ['DOWN', 'HEEL', 'SHAKE', 'SPEAK'], ['FLAT', 'NATURAL', 'QUARTER', 'WHOLE'], ['PUMP', 'STEAM', 'TIRE', 'WAFFLE']]","['AGENCY IN DECISIONMAKING', 'DOG COMMANDS', 'KINDS OF NOTES', '___ IRON']"
2024-05-28,"AMAZING, EASY, FLEXIBLE, OPEN, EVIL, VILE, LIVE, RECEPTIVE, WICKED, GENIUS, LIT, WAXY, BEGINNER, SOLID, VEIL, SCENTED","[['EASY', 'FLEXIBLE', 'OPEN', 'RECEPTIVE'], ['EVIL', 'LIVE', 'VEIL', 'VILE'], ['AMAZING', 'BEGINNER', 'GENIUS', 'SOLID'], ['LIT', 'SCENTED', 'WAXY', 'WICKED']]","['AMENABLE', 'ANAGRAMS', 'SPELLING BEE RANKS', 'ADJECTIVES FOR A CANDLE']"
2024-05-29,"BULLY, LEAD, EATS, GRUB, FARE, STOCK, CHOW, MEAT, DAUNT, RATTLE, STEER, FLEA, GUIDE, BULL, COW, DIRECT","[['CHOW', 'EATS', 'FARE', 'GRUB'], ['DIRECT', 'GUIDE', 'LEAD', 'STEER'], ['BULLY', 'COW', 'DAUNT', 'RATTLE'], ['BULL', 'FLEA', 'MEAT', 'STOCK']]","['FOOD', 'PILOT', 'INTIMIDATE', '___ MARKET']"
2024-05-30,"WEIGHT, CLOUT, RAID, SACK, CROP, SHAG, HAIR, SAFETY, BOB, SWAY, PUSH, PULL, FADE, ROB, BOBBY, LOOT","[['LOOT', 'RAID', 'ROB', 'SACK'], ['CLOUT', 'PULL', 'SWAY', 'WEIGHT'], ['BOB', 'CROP', 'FADE', 'SHAG'], ['BOBBY', 'HAIR', 'PUSH', 'SAFETY']]","['PLUNDER', 'INFLUENCE', 'HAIRSTYLES', '___ PIN']"
